pathway,pval,padj,log2err,ES,NES,size,LEGenes
HALLMARK_ADIPOGENESIS,0.05339590813566669,0.09344283923741671,0.019058155994328935,0.39436983061650593,1.2159536313976347,191,"DBT, CCNG2, MRAP, AGPAT3, CYP4B1, PTGER3, ANGPTL4, GPAT4, APLP2, ACO2, SDHC, MYLK, ADIG, CHUK, RREB1, MAP4K3, PEMT, FABP4, REEP5, ACADS, CMPK1, COQ9, PEX14, ORM1, FZD4, PTCD3, SLC19A1, NMT1, DLAT, COX6A1, ME1, ESRRA, BAZ2A, CMBL, ITSN1, SNCG"
HALLMARK_ALLOGRAFT_REJECTION,0.11224880310015435,0.1607198771661301,0.006544689788486066,-0.44926704030361597,-1.2056116663436913,193,"HLA-DRA, CAPG, HCLS1, HLA-DMB, HLA-DMA, IRF8, TIMP1, IL7, GCNT1, IL4R, CD3D, LYN, CCL19, PTPN6, TLR1, HLA-E, IL18"
HALLMARK_ANDROGEN_RESPONSE,6.228321540000546e-7,6.539737617000573e-6,0.6594443980379349,0.7024752559600181,1.9841009368431857,95,"AZGP1, PTK2B, NKX3-1, PIAS1, APPBP2, SORD, SEC24D, SRP19, ZMIZ1, STK39, CAMKK2, PMEPA1, ACSL3, ARID5B, TSC22D1, RRP12, MERTK, CDK6, ELK4, ANKH, MAP7, PGM3, TPD52, ACTN1, TMEM50A, UBE2J1, CENPN, HOMER2, ALDH1A3, ZBTB10, HPGD, MAK, ABHD2, RPS6KA3, KRT19, KLK2, IQGAP2, SLC38A2, SGK1, TMPRSS2, PTPN21, KRT8, B4GALT1, ELOVL5, TARP, SPDEF, XRCC5, PA2G4, AKT1, GPD1L"
HALLMARK_ANGIOGENESIS,0.6268069031292125,0.66930228639221,0.00367829972988618,0.37610055993824354,0.8961745453272906,35,"STC1, SERPINA5, VAV2, NRP1, FSTL1, APOH, FGFR1, POSTN"
HALLMARK_APICAL_JUNCTION,9.98107168918273e-7,8.982964520264458e-6,0.6435518361507222,0.5899196770595719,1.8188890677366232,191,"NRXN2, NECTIN1, CDH6, CDH15, ALOX15B, EGFR, TAOK2, MMP2, SDC3, NLGN2, RASA1, SORBS3, THY1, BAIAP2, AMIGO1, CADM3, CDH8, MAP4K2, ADAM23, VAV2, ITGA9, THBS3, ICAM1, INPPL1, TRO, PCDH1, PBX2, DSC1, NECTIN4, SKAP2, CTNNA1, NF1, FBN1, NEGR1, CADM2, CERCAM, CLDN18, IRS1, AKT3, ZYX, GTF2F1, NF2, TMEM8B, MPZL2, DMP1, ACTN1, SYMPK, LAMA3, SLIT2, AKT2, GRB7, MAPK11, CDH11, MYH10, FSCN1, ACTA1, TIAL1, CDH4, KCNH2, CLDN19, SIRPA, MYL9, ADAM9, BMP1, TRAF1, ACTN4, PIK3CB, CNTN1, TSC1"
HALLMARK_APICAL_SURFACE,0.0034607466755689088,0.011475107397939013,0.05783408166701909,0.6735237483600286,1.668343130974642,43,"PCSK9, MDGA1, PKHD1, GHRL, THY1, ATP8B1, DCBLD2, SCUBE1, SLC22A12, TMEM8B, CD160, GATA3, IL2RB, CROCC, FLOT2, NTNG1, SLC2A4"
HALLMARK_APOPTOSIS,0.19986808517928423,0.26639748287136683,0.009221820852037974,0.3634328703920495,1.0981869729895355,160,"CYLD, MMP2, GSN, AVPR1A, GADD45B, TOP2A, CD44, TGFB2, ATF3, FAS, DAP3, ROCK1, EREG, DCN, FASLG, ANKH, ERBB2, BGN, SATB1, NEFH, CREBBP, FEZ1, BCL2L10, BCL2L11, LMNA, PEA15, DPYD, XIAP, RARA, DFFA, PMAIP1, PLPPR4, SMAD7, PTK2, PPP2R5B, TAP1, CASP9, ERBB3, ADD1, HSPB1, IFITM3, F2, PSEN1, CFLAR, BCL10, HMGB2, RHOB, CASP6, ISG20, MADD, CASP8"
HALLMARK_BILE_ACID_METABOLISM,0.10785852332999113,0.1580252783671963,0.011663992612205876,0.41629164843168215,1.1985527816539088,109,"NEDD4, AR, NR1H4, CYP8B1, SULT2B1, AQP9, TFCP2L1, SLC23A1, NR1I2, SLC27A5, PEX6, SLCO1A2, ABCA9, ABCA2, CYP39A1, HSD17B4, GNMT, ABCA3, NPC1, ABCA4, PAOX"
HALLMARK_CHOLESTEROL_HOMEOSTASIS,0.6584870163781767,0.6914113671970856,0.0039655338808971844,0.33481055071375804,0.9048905694917251,71,"ANXA13, GPX8, AVPR1A, CD9, ATF3, CPEB2, ABCA2, GUSB, CBS, LDLR"
HALLMARK_COAGULATION,0.6911217479804084,0.713781477422389,0.004447800464592337,0.310036099585696,0.918562226175542,136,"F2RL2, PROC, MMP2, PDGFB, GSN, CFB, HNF4A, HRG, FURIN, CD9, DCT, FBN1, ANG, DUSP6, ITGB3, SERPINE1, MMP15, THBS1, TMPRSS6, MMP11, WDR1, HPN, CTSB, ADAM9, GP1BA, BMP1, PROZ, FGA, C8B, LRP1, KLKB1, MMP10, CASP9, SERPINA1, KLF7, TF, RAPGEF3, PRSS23, F2"
HALLMARK_COMPLEMENT,0.06419415843664636,0.10642715740812422,0.017479752546197568,0.3872851842808066,1.1974458235891603,196,"PCSK9, CASP10, PCLO, CDA, DGKH, VCPIP1, ITGAM, F5, PIK3R5, PDGFB, CFB, HNF4A, DOCK9, F7, MMP12, PPP2CB, LCP2, CD40LG, CBLB, CR1, CPM, ANG, RCE1, FCN1, DUSP6, SERPINE1, APOBEC3F, EHD1, CDK5R1, GNGT2, CXCL1, HPCAL4, MMP15, ZEB1, TMPRSS6, GCA, GATA3, TNFAIP3, PIK3CG, CP, JAK2, BRPF3, PLA2G4A, CTSB, ERAP2, KYNU, ADAM9, GP1BA, CTSC, MSRB1, MMP13, ME1, LRP1, APOA4, SPOCK2, KCNIP3, KLKB1, CEBPB, CASP9, ZFPM2, PRDM4"
HALLMARK_DNA_REPAIR,0.23411327747210325,0.3010027853212756,0.008251861826135354,0.3635492096500174,1.0841200016279178,143,"CDA, TAF10, POLD3, NPR2, GUK1, RAE1, BCAM, RFC3, RRM2B, POLE4, GTF3C5, ELL, GTF2F1, GTF2A2, ZWINT, VPS37B, MPG, PCNA, UPF3B, SDCBP, POLR2I, DGUOK, ERCC8, POLR1D, TARBP2, POM121, DUT, ADA, POLR2C, RNMT, BOLA2, PDE6G, TYMS, CLP1, REV3L, UMPS, RAD52, AK1, POLA2"
HALLMARK_E2F_TARGETS,0.07819023116865982,0.1263072965032197,0.01570701763171955,0.3834204872525322,1.1821937116694186,191,"GINS4, POLD3, PSIP1, TFRC, NAP1L1, BIRC5, BARD1, TOP2A, CHEK1, CDC25A, RACGAP1, RFC3, GINS3, MCM4, POLE4, LMNB1, CDC20, MCM6, SPC24, SPAG5, CDKN2A, SRSF1, ESPL1, PRKDC, HELLS, LUC7L3, XPO1, IPO7, SMC6, SHMT1, HMGA1, CCNE1, STMN1, PCNA, MKI67, TK1, TIMELESS, MAD2L1, WDR90, SYNCRIP, PDS5B, DIAPH3, ATAD2, RRM2, CDK1, POLE, DUT"
HALLMARK_EPITHELIAL_MESENCHYMAL_TRANSITION,0.037240443943532826,0.07109539298310813,0.023015798043262693,0.4021247267344275,1.2433281574771986,196,"TGFB1, CALD1, CDH6, SFRP1, COL5A1, MMP2, ELN, SNTB1, THY1, SLC6A8, GADD45B, PVR, PMEPA1, CD44, NOTCH2, TPM1, SGCD, FBN2, TGM2, MFAP5, THBS2, COL11A1, MYLK, FAS, CADM1, FBN1, DCN, APLP1, FBLN1, DST, ITGB3, LOX, P3H1, BGN, EFEMP2, SERPINE1, FSTL3, SPOCK1, EDIL3, LAMA3, CXCL1, FSTL1, SLIT2, THBS1, CDH11, TNFAIP3, TNC, POSTN, COL6A2, CDH2"
HALLMARK_ESTROGEN_RESPONSE_EARLY,2.0870634768432473e-5,1.0957083253427048e-4,0.5756102610711286,0.5415580428123928,1.6723581504126006,194,"NPY1R, MYBL1, SLC16A1, TBC1D30, MUC1, RHOD, SLC2A1, RAB17, AR, FRK, ADCY9, BHLHE40, ANXA9, MED13L, WWC1, PTGES, GREB1, SULT2B1, ALDH3B1, CD44, KDM4B, KCNK15, TGM2, CELSR1, RRP12, LRIG1, ITPK1, SLC7A2, OVOL2, NBL1, BCL2, SOX3, THSD4, TSKU, TMPRSS3, ABCA3, FARP1, IL6ST, HR, NADSYN1, HES1, NRIP1, SFN, MYB, NCOR2, RET, KLF10, RARA, TFF1, JAK2, SCNN1A, DLC1, AKAP1, PMAIP1, ABHD2, RAB31, OPN3, KRT19, SYNGR1, AFF1, PEX11A, MAPT, OLFM1, SLC22A5, CELSR2, XBP1, MAST4, ELF3, IGF1R, RASGRP1, PRSS23, SVIL, TIAM1, SLC19A2, KRT8, B4GALT1, RPS6KA2, ELOVL5, ADCY1, KCNK5, SEC14L2, PAPSS2, KLK10, CHPT1, SH3BP5"
HALLMARK_ESTROGEN_RESPONSE_LATE,0.007142651697458366,0.01687263206805347,0.0528346192849726,0.44149777772709897,1.3657260722636866,197,"NPY1R, DNAJC12, SLC16A1, FRK, PTGER3, ANXA9, SORD, PTGES, SULT2B1, ALDH3B1, TOP2A, SERPINA5, CD44, CD9, GPER1, CACNA2D2, PERP, ST6GALNAC2, GAL, ITPK1, OVOL2, NBL1, CDC20, ST14, BCL2, TH, SOX3, TMPRSS3, ABCA3, FARP1, IL6ST, HR, HOMER2, NRIP1, SFN, MYB, NCOR2, GINS2, RET, TFF1, JAK2, SCNN1A, GALE, PLXNB1, ABHD2, RAB31, OPN3, KRT19, BATF, AFF1, LARGE1, MAPT, OLFM1, SLC22A5, CELSR2, PRLR, XBP1, MAPK13, TSPAN13, SERPINA1, SGK1, PRSS23, TIAM1, RPS6KA2, UNC13B, ELOVL5, GJB3, KCNK5, ISG20, HMGCS2, KLK11, PAPSS2, KLK10"
HALLMARK_FATTY_ACID_METABOLISM,0.2643396748471916,0.32025768298794366,0.00786491777375789,0.3544916153309827,1.065551877393277,153,"XIST, CPT1A, TDO2, ACO2, SDHC, UROS, RDH16, HSD17B4, ADH1C, SUCLG2, EPHX1, ENO3, ACADS, FMO1, AUH, HPGD, HSP90AA1, MAOA, ME1, S100A10, GAPDHS, HSDL2, SLC22A5, CD1D, BPHL, HIBCH, MGLL, ELOVL5, HMGCS2, VNN1, ACSM3, ACSL4, FABP2, ACSL5, GRHPR, ACSS1, ACSL1, SMS, GAD2, ADIPOR2, ENO2, ACADM, ACOX1, IDI1"
HALLMARK_G2M_CHECKPOINT,2.5571237077440578e-5,1.239221489137505e-4,0.5756102610711286,0.5423935806048662,1.6685952649097466,187,"TGFB1, DR1, RPS6KA5, BIRC5, FANCC, BARD1, TOP2A, CHEK1, TPX2, RAD54L, NOTCH2, CDC25A, RACGAP1, EXO1, PBK, KIF20B, UPF1, E2F2, SFPQ, RBL1, TNPO2, LMNB1, CDC20, TROAP, RASAL2, SLC12A2, DMD, MCM6, KIF15, SRSF1, PRPF4B, ESPL1, CHAF1A, XPO1, MTF2, HMGA1, CUL3, NUP50, STMN1, BUB3, POLQ, MKI67, TLE3, GINS2, PURA, MAD2L1, CUL4A, CDC27, HNRNPU, ARID4A, FOXN3, SYNCRIP, PDS5B, CHMP1A, G3BP1, CDK1, POLE, ATF5, MEIS1, CASP8AP2, PRC1, DTYMK, NUMA1, ATRX, NUP98, SLC7A1, SAP30, HNRNPD, ABL1, POLA2, CKS2, SLC38A1, NUSAP1, EZH2, TOP1, YTHDC1, EFNA5, EWSR1, CENPF, ORC5"
HALLMARK_GLYCOLYSIS,2.291642455713586e-6,1.804668433874449e-5,0.6272567397185284,0.5620871445094732,1.7369140594225474,195,"CLN6, AGRN, HDLBP, B4GALT4, STC1, EGFR, PKM, COL5A1, SDC3, ANGPTL4, GALK1, CHPF, PGM2, SDHC, CD44, PPFIA4, SLC25A13, CACNA1H, HS6ST2, PPP2CB, MERTK, PPIA, DSC2, PHKA2, DCN, ANG, FBP2, B3GAT1, DDIT4, SLC35A3, GUSB, RBCK1, IRS2, B4GALT2, MIOX, GAL3ST1, AGL, PFKFB1, CHST12, STMN1, PYGB, IDUA, GALE, B3GALT6, ALDH7A1, LHX9, CDK1, LHPP, B4GALT7, ME1, PFKP, GAPDHS, POLR3K, NDUFV3, COG2, BPNT1, TGFA, ELF3, B3GNT3, LCT, RPE, NT5E, GLRX, SAP30, B4GALT1, SLC25A10"
HALLMARK_HEDGEHOG_SIGNALING,0.04791599699989285,0.08878552385274265,0.015118249797847334,0.5922457768654804,1.4189582811125139,36,"NRP2, RASA1, THY1, GLI1, CELSR1, NKX6-1, NRP1, NF1, CDK6, PTCH1, CDK5R1, L1CAM, SHH, ACHE, TLE3"
HALLMARK_HEME_METABOLISM,1.6142785866034552e-8,2.542488773900442e-7,0.7337619883564803,0.6211462884379808,1.9142709180742545,190,"HBB, DAAM1, TRIM58, SLC2A1, HTATIP2, CROCCP2, RHAG, SPTA1, TFRC, SLC6A8, EPOR, TMCC2, LMO2, TAL1, CAST, BCAM, FOXO3, HBD, FBXO34, IGSF3, ANK1, UROS, NR3C1, ARHGEF12, CIR1, DCUN1D1, SEC14L1, SMOX, GATA1, E2F2, FBXO9, SLC25A37, HDGF, ADD2, OSBP2, EZH1, TCEA1, SLC11A2, EPB41, RAD23A, FTCD, RCL1, FECH, GAPVD1, UBAC1, ATG4A, BMP2K, SLC25A38, PDZK1IP1, NFE2, SYNJ1, NFE2L1, RANBP10, HEBP1, CDC27, TNRC6B, CTSB, SDCBP, EIF2AK1, TYR, ALDH6A1, PPP2R5B, RNF19A, GYPE, SIDT2, ALAS2"
HALLMARK_HYPOXIA,2.2821497850975618e-4,8.985964778821649e-4,0.2975758284510036,0.5114853777775471,1.5794922662416686,194,"HDLBP, STC1, B4GALNT2, PPARGC1A, EGFR, CCNG2, SLC2A1, COL5A1, ILVBL, SDC3, ANGPTL4, PDGFB, BHLHE40, GALK1, JMJD6, HEXA, SULT2B1, PGM2, PCK1, PPFIA4, FOXO3, DUSP1, NR3C1, TGM2, BCAN, ATF3, VHL, DCN, ETS1, DDIT4, BCL2, STBD1, LOX, BGN, IRS2, SERPINE1, TPD52, NEDD4L, IDS, PRKCA, TNFAIP3, CDKN1C, AMPD3, ENO3, PDK1, CP, SLC2A5"
HALLMARK_IL2_STAT5_SIGNALING,0.006821646341463415,0.01687263206805347,0.05389627180835964,0.4433073122262223,1.3698706877961153,195,"HUWE1, CTLA4, F2RL2, MUC1, IL2RA, ICOS, BHLHE40, GADD45B, RGS16, MYO1C, CD79B, NOP2, ABCB1, FURIN, CD44, IKZF2, HIPK2, SMPDL3A, IL1RL1, PHTF2, ST3GAL4, SYNGR2, TGM2, GATA1, SLC39A8, CSF1, NRP1, LRIG1, MYO1E, CD48, IL13, SOCS2, APLP1, SCN9A, CDC42SE2, RABGAP1L, LTB, BCL2, PTCH1, GALM, RNH1, SOCS1, BMPR2, PTGER2, AHNAK, SLC29A2, CDKN1C, SPRED2, CCR4, HOPX, CCNE1, IL2RB, ENO3"
HALLMARK_IL6_JAK_STAT3_SIGNALING,0.007231128029165773,0.01687263206805347,0.04388292389140861,0.5388574604228986,1.5027801605939992,87,"ACVR1B, TGFB1, IL2RA, PIK3R5, CXCL11, IL12RB1, PTPN2, CD44, CD9, CSF1, FAS, LTB, ITGB3, CXCL9, OSMR, CXCL1, SOCS1, STAM2, IL6ST"
HALLMARK_INFLAMMATORY_RESPONSE,0.007193134702535918,0.01687263206805347,0.05279911883288183,0.44020070037091286,1.363246819814657,199,"ACVR1B, ATP2C1, CXCR6, OPRK1, PCDH7, CYBB, PIK3R5, CXCL11, RIPK2, DCBLD2, PVR, ATP2B1, RGS16, AQP9, TNFAIP6, LPAR1, ICAM1, C5AR1, LCP2, CSF1, SLC7A2, CD48, TACR1, EREG, SLC11A2, LAMP3, ITGB3, CXCL9, SERPINE1, SGMS2, PTGER4, SCN1B, LDLR, OSMR, CCL22, STAB1, ITGB8, PTGER2"
HALLMARK_INTERFERON_ALPHA_RESPONSE,0.3715010850774267,0.41060646245399796,0.0034189672540743876,-0.42214180906760657,-1.0485606392408737,92,"IFIT3, PARP12, PSMB9, LAP3, IL7, IL4R, IRF9, GMPR, DDX60, CD74, GBP4, SELL, BST2, HLA-C, MVB12A, RSAD2, EPSTI1"
HALLMARK_INTERFERON_GAMMA_RESPONSE,0.25537562240716444,0.3154640041500267,0.004059472546435003,-0.4103201797601938,-1.1015763456740943,194,"HLA-DRB1, HLA-DMA, IRF8, IFIT3, PARP12, PSMB9, LAP3, IL7, CD69, IL4R, FGL2, HLA-B, IRF9, UPP1, GCH1, DDX60, VAMP8, PTPN6, SERPING1, VCAM1, C1R, HLA-G, CD74, NLRC5, GBP4, XAF1, BST2, PTGS2, RSAD2, EPSTI1, HLA-DQA1"
HALLMARK_KRAS_SIGNALING_DN,4.048782914351346e-6,2.6515639513683104e-5,0.610526878385931,0.5590861174813171,1.7245234332272656,192,"RYR2, GPRC5C, GP2, ATP4A, RIBC2, TG, NRIP2, IFNG, NPHS1, BARD1, EPHA5, TFCP2L1, SNN, KMT2D, EDAR, P2RY4, TGFB2, ALOX12B, CD207, CD40LG, PDK2, SLC16A7, CPEB3, SLC25A23, NTF3, ARPP21, GTF3C5, CYP39A1, SHOX2, INSL5, PDE6B, FSHB, MFSD6, KCND1, MAGIX, CYP11B2, COPZ2, SLC12A3, ADRA2C, IFI44L, C5, PAX4, GDNF, SKIL, IDUA, CAMK1D, CD80, KCNMB1, GP1BA, MYH7, TEX15, DTNB, SPHK2, SYNPO, CELSR2, THRB, EFHD1, GPR19, CKM, AMBN, SGK1, MYOT, PKP1, YPEL1, IGFBP2, VPREB1, CACNA1F, TGM1, SNCB, TENM2"
HALLMARK_KRAS_SIGNALING_UP,0.1900418346100212,0.265476925822077,0.010022328620074872,0.35361661035348335,1.0933460674615305,196,"STRN, ANGPTL4, NR1H4, CFB, MYCN, DCBLD2, RGS16, ARG1, ABCB1, NGF, KIF5C, EVI5, CBR4, FGF9, ADAMDEC1, TRIB1, NRP1, ANXA10, IL1RL2, PPBP, EREG, ANKH, ETS1, MAP7, RABGAP1L, ATG10, F2RL1, DUSP6, MPZL2, SATB1, AVL9, TNNT2, SCN1B, AKT2, PLEK2, TFPI, MMP11, MTMR10, TNFAIP3, TOR1AIP2, PLVAP, ALDH1A3, DOCK2"
HALLMARK_MITOTIC_SPINDLE,2.8412993870607097e-15,1.790018613848247e-13,1.0073179568744748,0.7138407332778302,2.2097343839275903,198,"SHROOM1, AKAP13, TUBGCP3, TAOK2, CDC42EP2, CDC42BPA, RASA1, RALBP1, ALMS1, SSH2, GSN, ARHGEF11, CDK5RAP2, DYNC1H1, TRIO, HOOK3, KLC1, BIRC5, PLEKHG2, TOP2A, TPX2, CEP57, CTTN, NOTCH2, CLIP2, ARHGEF7, RACGAP1, KIF3B, ARHGEF12, KIF20B, TBCD, PIF1, MYO1E, LRPPRC, KNTC1, PCGF5, NF1, ROCK1, PPP4R2, STK38L, RAPGEF5, CCDC88A, LMNB1, CSNK1D, NET1, RASAL2, ARHGEF3, KIF15, DST, SORBS2, EPB41, RAPGEF6, GEMIN4, ESPL1, STAU1, ARHGAP5, RABGAP1, RICTOR, WASF1, FARP1, ARFGEF1, PALLD, SUN2, MYH10, CYTH2, FSCN1, BCL2L11, ALS2, KPTN, DOCK2"
HALLMARK_MTORC1_SIGNALING,0.006235268708153741,0.01687263206805347,0.05597133798130366,0.4476920074188642,1.3797132913912338,190,"STC1, DAPP1, SLC2A1, NFYC, BHLHE40, NUFIP1, TFRC, SORD, SSR1, ACSL3, CDC25A, CD9, GSK3B, ACACA, PPIA, MCM4, SKAP2, PSPH, TBK1, TCEA1, DDIT4, LDLR, GGA2, UCHL5, TOMM40, TXNRD1, PDK1, IGFBP5, EIF2S2, MTHFD2L, HSPD1, NMT1, SLC6A6, RRM2, CTSC, NUPR1, PDAP1, ME1"
HALLMARK_MYC_TARGETS_V1,0.19384029504469114,0.265476925822077,0.009751384545747657,0.3561796989771687,1.094479938435754,185,"TARDBP, NAP1L1, RPL14, FAM120A, CAD, SRPK1, EIF3B, HDGF, PPIA, MCM4, DDX18, SRSF3, CDC20, U2AF1, MCM6, HDAC2, RPL34, EIF1AX, SRSF1, XPO1, SRM, BUB3, PCNA, HDDC2, RPL18, MAD2L1, EIF4E, EIF2S2, HNRNPU, SNRPA, EIF4G2, SYNCRIP, SF3B3, HSPD1, HNRNPA1, G3BP1, PRPS2, TOMM70, XPOT, DUT, SNRPA1, SSB, TYMS"
HALLMARK_MYC_TARGETS_V2,0.057134095278534615,0.09728237844723461,0.01451510446388932,0.5209995473305612,1.3490831545841246,55,"TFB2M, SORD, NOP2, RRP12, MCM4, DDX18, RCL1, WDR74, SLC29A2, SRM, MRTO4, HSPD1, SLC19A1"
HALLMARK_MYOGENESIS,4.208831668838588e-6,2.6515639513683104e-5,0.610526878385931,0.5608340614923304,1.7340410424107708,196,"MYL1, AGRN, TGFB1, MYH11, DAPK2, LDB3, PDE4DIP, ADCY9, BHLHE40, NQO1, GSN, SORBS3, FOXO4, SLC6A8, GADD45B, CTF1, MYO1C, MEF2D, CAMK2B, PPFIA4, COX6A2, SGCD, SYNGR2, CACNA1H, MYLK, FKBP1B, PTP4A3, CHRNA1, SOD3, DMD, MYOG, CAV3, PDLIM7, HRC, DES, TNNT2, MYL7, MYBPC3, AKT2, MYBPH, ACHE, AGL, FST, COL6A2, ACTA1, ENO3, MYOZ1, NOTCH1, KCNH2, CSRP3, MAPRE3, MRAS, GNAO1, MYH7, MAPK12, SH3BGR, LARGE1, HDAC5, COL1A1"
HALLMARK_NOTCH_SIGNALING,0.27010852551393094,0.32107239825240846,0.0060035475960668275,0.485561445216133,1.1284393074319925,31,"PPARD, NOTCH2, PRKCA, ST3GAL6, HES1, SKP1, NOTCH1, HEYL, SAP30, LFNG, TCF7L2"
HALLMARK_OXIDATIVE_PHOSPHORYLATION,0.08595278585404209,0.13207379289767443,0.014739325658317945,0.3845971091335765,1.1788643422379605,181,"NDUFA7, CPT1A, MTRR, NQO2, ACO2, SDHC, LRPPRC, SLC25A12, NDUFS4, TCIRG1, NDUFV1, COX4I1, ACADSB, OPA1, RHOT1, ABCB7, ATP6V1C1, NDUFA3, TIMM9, ALDH6A1, DLAT, NDUFA2, COX6A1, TOMM70, ATP6V0E1"
HALLMARK_P53_PATHWAY,3.685828111466582e-5,1.5480478068159644e-4,0.557332238758646,0.5358347614044215,1.6513547931344628,190,"ACVR1B, TGFB1, ALOX15B, MKNK2, CCNK, BAIAP2, RGS16, FOXO3, TRAF4, EPS8L2, ZFP36L1, CLCA2, TSC22D1, GPX2, PERP, TP63, ATF3, FAS, PITPNC1, DDIT4, ST14, MDM2, NHLH2, CDKN2A, OSGIN1, ZNF365, PIDD1, PVT1, CDK5R1, SOCS1, RCHY1, STEAP3, VDR, PLK3, SESN1, SFN, EPHX1, PCNA, RPS12, RPL18, WWP1, RAB40C, NOTCH1, LIF, KIF13B, CDKN2B, ZMAT3, DGKA, NUPR1, S100A10, POM121, CYFIP2, ADA, TAP1, TGFA, MAPKAPK3, CCP110, HEXIM1, SLC19A2, RXRA, TRAFD1, RALGDS, PRMT2, AK1"
HALLMARK_PANCREAS_BETA_CELLS,0.36170541219168717,0.40691858871564807,0.0037371322973718804,-0.4833751310248246,-1.0692420734337822,40,"SST, PCSK1, MAFB"
HALLMARK_PEROXISOME,0.007043397785957005,0.01687263206805347,0.04565650500947945,0.5186047455747625,1.477694297209967,101,"CLN6, STS, SULT2B1, TOP2A, ABCB1, ABCB9, ESR2, NR1I2, CRABP2, CADM1, PEX6, CLN8, HSD17B4, ALB, SEMA3C, FABP6, CRABP1, PEX14, ABCC8, ABCD1"
HALLMARK_PI3K_AKT_MTOR_SIGNALING,1.0971113291356026e-5,6.28345579414027e-5,0.5933254763964051,0.6421541116515439,1.8376612742703793,104,"DAPP1, EGFR, SLC2A1, MKNK2, MAPK1, PLA2G12A, NGF, RPTOR, MAPK8, PAK4, GSK3B, CAMK4, ACACA, PLCB1, TBK1, RIPK1, FASLG, SMAD2, MAPKAP1, PIKFYVE, IL4, SFN, GRK2, PDK1, EIF4E, CLTC, RPS6KA3, GNGT1, PRKAA2, CDK1, MKNK1, MAP3K7, PPP2R1B, UBE2D3, CFL1, FGF17, TIAM1, MAP2K6"
HALLMARK_PROTEIN_SECRETION,0.0013686415196068266,0.005072024455013534,0.10263718561369185,0.5697287362293912,1.6091660307015239,95,"RAB2A, ERGIC3, EGFR, ATP1A1, SEC24D, MAPK1, VAMP4, ARFGEF2, CLTA, COPB1, CAV2, DST, TPD52, AP1G1, SNX2, GBF1, ARFGEF1, GOSR2, SEC31A, SCAMP1, TSPAN8, CLTC, GNAS, RPS6KA3, CTSC, VAMP3"
HALLMARK_REACTIVE_OXYGEN_SPECIES_PATHWAY,0.015614307222044802,0.032790045166294086,0.02749826710412253,0.6007803518101742,1.5187291112464811,48,"TXNRD2, MBP, PTPA, NQO1"
HALLMARK_SPERMATOGENESIS,0.008213294879230082,0.018479913478267686,0.044528914306704206,0.4817488111988304,1.4223012386731433,132,"ZC3H14, TCP11, GAD1, CLPB, GPR182, DMC1, PGS1, ODF1, ACRV1, DPEP3, CAMK4, MLLT10, PAPOLB, ADAD1, DMRT1, CSNK2A2, MAP7, PHKG2, SLC12A2, NF2, MTOR, SYCP1, TNP2, NEFH, STAM2, TSSK2, SIRT1, COIL, SLC2A5, PHF7, CNIH2, SNAP91, NCAPH, CDK1, PEBP1, GAPDHS, ART3"
HALLMARK_TGF_BETA_SIGNALING,0.018006015580003143,0.03615776537457115,0.0258542053907566,0.5814253059244553,1.4908194692426946,52,"TGFB1, SMAD6, PMEPA1, FURIN, HIPK2, PPM1A, TRIM33, SERPINE1, ARID4B, SMURF1, THBS1, BMPR2, CDKN1C, NCOR2, XIAP, KLF10, SKIL, RAB31, ID1, SMAD7, MAP3K7, SKI, UBE2D3"
HALLMARK_TNFA_SIGNALING_VIA_NFKB,0.0533262333117797,0.09344283923741671,0.019157588233648385,0.39310900053873876,1.2139401302904387,194,"NFE2L2, KDM6B, CXCL11, BHLHE40, RIPK2, TRIP10, TNIP2, GADD45B, ATP2B1, PMEPA1, TNFAIP6, CD44, SNN, DUSP1, TNFAIP2, ICAM1, FOSB, TSC22D1, TRIB1, ATF3, CSF1, F2RL1, IRS2, SERPINE1, EHD1, IL23A, PTGER4, LDLR, CXCL1, IL6ST, SLC16A6, TNFAIP3, HES1, TNC, ZBTB10, CLCF1, NFKB2, KLF10, LIF, CD80, KYNU, PHLDA2, TRAF1, NFKBIA, SERPINB8, INHBA, SPSB1, TAP1, CEBPB, CSF2, DNAJB4, REL"
HALLMARK_UNFOLDED_PROTEIN_RESPONSE,0.5310960788646456,0.5768802235943564,0.004875683810558162,0.33601684264062365,0.9615840310282834,104,"SSR1, PAIP1, EIF2AK3, NFYA, ATF3, ARFGAP1, SDAD1, LSM4, DDIT4, DNAJA4, GEMIN4, GOSR2, CXXC1, SEC31A, CNOT6, EIF4E, EXOSC2, KHSRP, CNOT2, SRPRB, XPOT, ATF6, TATDN2, CEBPB, XBP1, CNOT4, FUS, DCP2, ZBTB17, EEF2, STC2, ERN1, EIF4G1, LSM1, NABP1"
HALLMARK_UV_RESPONSE_DN,3.352596943093467e-5,1.5086686243920603e-4,0.557332238758646,0.5745966503471488,1.7040880194852666,137,"ATP2C1, RBPMS, SCN8A, CDC42BPA, BHLHE40, CDK13, KALRN, ATP2B1, ZMIZ1, SYNJ2, PLCB4, LPAR1, DUSP1, SPOP, NOTCH2, VAV2, MMP16, NR3C1, CELF2, COL11A1, PTPRM, KCNMA1, NRP1, DBP, MAP1B, NFIB, IRS1, AKT3, WDR37, ITGB3, ERBB2, SFMBT1, SERPINE1, LDLR, PRDM2, PRKCA, TFPI, PRKCE, CDON, PIK3CD, DYRK1A, PHF3, NR1D2, PEX14, IGFBP5, SYNE1, ATRN, DLC1, ID1"
HALLMARK_UV_RESPONSE_UP,0.08879168944778568,0.1331875341716785,0.013893186401136902,0.3957642084003822,1.190493181212071,154,"RAB27A, TFRC, SLC6A8, TGFBRAP1, WIZ, ABCB1, FURIN, PTPRD, ICAM1, FOSB, PPAT, NTRK3, ATF3, TYRO3, GAL, NUP58, SHOX2, FGF18, IL6ST, CLTB, CDKN1C, BCL2L11, CCNE1, EPHX1, CYB5R1, FMO1, RET, CNP, KCNH2, MGAT1, HNRNPU, EIF2S3, ATP6V1C1, CDKN2B, NFKBIA, MAOA, PLCL1, MAPK8IP2, PDAP1, OLFM1, TAP1, STIP1, EIF5, RASGRP1, IGFBP2, NXF1, MMP14, PRKACA, RHOB, EPCAM, PPP1R2"
HALLMARK_WNT_BETA_CATENIN_SIGNALING,0.006530693156538403,0.01687263206805347,0.041851235167008276,0.6580633868394623,1.6156885666998924,41,"FRAT1, PPARD, DKK4, HDAC2, PTCH1, NCOR2, NOTCH1, DKK1, WNT5B, TCF7, SKP2, HDAC5, NUMB, RBPJ, WNT6, TP53, NCSTN, LEF1, FZD1, MAML1, PSEN2"
HALLMARK_XENOBIOTIC_METABOLISM,0.0036608150529680106,0.011531567416849233,0.07345049737204103,0.45620887602839216,1.4080310066118817,193,"CDA, SSR3, ABCC2, AOX1, NQO1, CYP17A1, GAD1, TDO2, CFB, HNF4A, PTGR1, PTGES, PPARD, ACO2, ARG1, HRG, AQP9, SMOX, TGFB2, MPP2, FAS, ANGPTL3, FBLN1, ABHD6, ESR1, CYP2C18, GART, GNMT, FETUB, SERPINE1, ADH1C, HES6, DDC, NPC1, PEMT, ABCC3, EPHX1, FMO1, COMT, CYP27A1, DHRS1, KYNU, NMT1, SLC6A6, TYR, MAOA"
SMITA_FA_OXIDATION,0.33233330743624834,0.3806726976087936,0.005767689142771579,0.4049851285795275,1.0581483426864597,58,"CPT1A, ACSL3, SLC27A5, PCBP2, HSD17B4, SLC40A1, PCCA, STEAP3, ACADSB, ACADS, CP"
SMITA_FA_SYNTHESIS,0.01554271725167634,0.032790045166294086,0.029944411833836514,0.5121234425253041,1.4305774887471043,88,"ASAH1, ACSL3, ABCB9, CBR4, ACSM5, ACACA, HSD17B12, GNPTAB, ABCA2, NAPSA, ACSF3, LAMP3, ELOVL7, HYAL4, IDS, NAGLU, ACSBG2, GGA2, ACADSB, ELOVL4, ACADS, NAGPA, IDUA, ENTPD4, MCOLN1, ACACB, CTSC, HGSNAT, WDR7, NCOA7, ELOVL5, ELOVL2-AS1, CD164, ELOVL6, ACSM3, ACSL4, ACSL5, ACSL6"
SMITA_GLUCONEOGENESIS,0.0022869919529662796,0.008004471835381978,0.0718814139028698,0.6692034388558461,1.685013762538472,47,"SLC16A1, PKM, SLC2A1, PGM2, PCK1, SLC25A13"
SMITA_GLUTAMATE_RECEPTORS,4.3013537331273256e-9,9.032842839567384e-8,0.7614608014455848,0.5620455183981992,1.8064690888070138,293,"PPP1R1A, GRIN2A, FARP2, GRIN1, C7, GNRHR, RGS14, RALGAPA1, HOXA11, SCN2A, MAGI3, PLCE1, RUNX2, FOXO4, SIPA1L3, AVPR1A, HTR2A, MYCN, TAF15, ATP2B1, KCNC3, ADRB1, GRM5, LMO2, TBXA2R, GNB3, GRIN3A, P2RY4, NOS1AP, NR3C1, NFYA, GPER1, C5AR1, FOSB, NAPEPLD, KISS1, GRIK2, SS18L1, KMT2A, CDK14, PTCRA, GAL, CHRNA1, NF1, RAPGEF5, DAGLB, GRIN2B, FGF14, TACR1, CSNK1D, SLC1A6, ELK4, RUNX1T1, ABHD6, GRIN2D, DUSP6, HRH3, DAB1, RAPGEF6, TRPM5, TPCN2, GRM4, INSL5, UTS2, JMJD1C, OPRM1, KCND3, AFDN, BMP2K, APLN, ORAI2, HOXA10, SUPT3H, GRID1, KDM6A, KRIT1, SIX4, CNGB1, GPHB5, OPA1, FCGR1A, PDE1A, EBAG9, GRP, GRIK3, CEBPE, CHRNA4, FEV, CIC, LTB4R, TAS1R1, TFF1, SCNN1A, HCN4, CAMK1D, MCOLN2, CD80, MRAS, MYL9"
SMITA_GLYCOGENESIS,1.1728107115603926e-11,3.6943537414152367e-10,0.8753251320246591,0.5661104860842655,1.8594434154600166,380,"DUSP9, CTLA4, IRAK3, IL17F, AKAP13, CXCR2, CXCR6, SOX2, S100A7A, DAPP1, RHOD, PIAS1, RGS3, ARID1B, FNIP2, TBX3, RIF1, ICOS, RASA1, ZFHX3, WWC1, SSH1, GRAP2, RASSF6, CD79B, SLC38A9, GRB10, PGM2, TRAF4, PBRM1, NGF, ARHGEF7, SOST, LCN2, PGM5, LGR4, GPR161, GSK3B, ROBO2, NTRK3, TAB3, CBLB, ANAPC5, MCM4, REG4, NRG1, SKAP2, MIB2, MATK, FZR1, CD247, OAS1, PLCG2, CTNND2, LIMK1, LRRC4, IL13, EREG, GLI2, NTF3, SMARCD1, TBL1X, TRAF5, OTX1, SENP2, ROR1, MCM6, PGM3, ZYX, NEO1, DCHS2, KAT6A, SRSF1, NF2, MAPKAP1, IQCE, PRKDC, BRD7, RICTOR, L1CAM, ELMO1, NRG2, LRIG2, SLIT2, RCHY1, CBY1, HAND1, GSK3A, IL4, CUL3, MUC5AC, SFN, BMP7, LBP, PCNA, DOCK2, PORCN, PYGB, PRICKLE1, SEMA7A, SMARCB1, SMARCA2, SKIL, LIF, GIT2, CARD11, IL17RE, LATS2, CD200R1, SLIT3, CHD8, CCL11, GNAO1, MAVS, EIF2AK1, NCK2, KIDINS220, NTNG1, IL17RC, SMAD7, MMP13, USP25, ABLIM3, NRG4, SMC1B, INHBA"
SMITA_GLYCOGENOLYSIS,0.24122708745500918,0.30394613019331157,0.006080348186687585,0.5802593596400148,1.1886731247553723,17,"PHKB, PGM2, PGM5, PHKA2, PHKG2, PYGB"
SMITA_GLYCOLYSIS,0.01836584907914725,0.03615776537457115,0.03103612269297364,0.43964152373167875,1.3275788939048392,159,"PKM, DDX6, GSN, KPNA1, PIK3C2A, IPMK, NKX6-1, LSM6, ITPK1, PATL1, HNF1B, PIP5KL1, NEUROD1, LSM4, XRN1, CNOT6L, PIKFYVE, MIOX, ACBD3, PIP4K2A, ISYNA1, PAX4, FBXO22, PLEKHM2, EXOSC3, RHOJ, HPN, EXOSC2, HSPD1, IPPK, CNOT7, SP100, CNOT2, S100A10, PFKP, CNOT3, MPHOSPH6, PGK2, CNOT4, INPP4A, BAIAP2L1, INPP5B, DCP2, AHNAK2, RHOB, VDAC3, STX10, GCC2, FOXA2, LSM1, DNM2, ZCCHC7, ALDOB, JAK3, ENO2, DIS3"
SMITA_HMP_SHUNT_GLUTATHIONE,0.9581191316412119,0.9581191316412119,0.002888446962416272,0.28277532950269246,0.7201982659122508,50,"ALOX15B, TG, ALOX12B, ALB, CYP2C19, TTF1, ALOX12, DUOX2, RPE, SERPINA7, SLC26A4, CYP4F8, ALOXE3"
SMITA_KETONE_BODY_SYNTHESIS,0.2938135185138252,0.3427824382661294,0.00563426270636663,0.49799197211867946,1.116638268326885,26,"OXCT2, RCE1, GGPS1, ICMT, PCYOX1, ELOVL4, ACSS2, ELOVL5, HMGCS2, ELOVL6, ACSS1, IDI1"
SMITA_LACTATE_SHUTTLE,2.491842862036362e-7,3.1397220061658158e-6,0.674962860011025,0.6585682700988751,1.9371433158250693,128,"KCNJ6, PCLO, SLC16A1, IGF2BP1, SLC2A1, ABCC2, NR1H4, MIR205, SLC6A11, HOXD10, SLC12A5, AQP9, MMP16, CPLX2, PAK4, FOXP1, TGFB2, DICER1, TP63, E2F2, VAMP2, SLC16A7, SLC16A8, MDM4, ST14, CYP3A4, RECK, SLC10A1, STX1B, XPO1, CYP1B1, RANBP3, ABCC3, FSCN1, TNC, PIK3R1, STMN1, EPHX1, TRPM4, AQP8, XIAP, MAD2L1, TRIM71, MIR146A, DLAT, PLCL1, DNMT3A, HDAC5, ZEB2, TRRAP, KCNN2, ZFPM2, SNAP25"
SMITA_TCA_CYCLE,0.08447975489607112,0.13207379289767443,0.010917019046534717,0.6221350652531055,1.3719627142653763,24,"ACO2, SDHC, SUCLG2, ACO1, DLAT, OGDH"
SMITA_UREA_CYCLE,0.20296951075913663,0.26639748287136683,0.007211114053029985,0.48123657964375693,1.1759156712456313,40,"CDA, TRPV4, DHODH, NPPC, ARG1, CAD, TK1, NT5C3B, NOX1, NAGS, DUT, AGMAT, CD1A, PIAS4, DTYMK, TYMS, HSPB1, UMPS"
SMITA_VARIOUS_METABOLITES,0.7951366869191062,0.807961472191995,0.00218221882580667,-0.39171675091744884,-0.7641078218966556,19,"PNMT, CEL"
