pathway,pval,padj,log2err,ES,NES,size,LEGenes
HALLMARK_ADIPOGENESIS,0.6699626906241942,0.7277180949883489,0.002342714977694772,-0.33143188174593924,-0.9181953007773302,191,"CIDEA, GPX3, G3BP2, NKIRAS1, DLAT, COX8A, GPX4, NDUFAB1, GADD45A, ALDOA, GHITM, NDUFS3, MDH2, MRPL15, UQCRQ, LPL, ATL2, CYC1, CHCHD10, PDCD4, UQCRC1, RNF11, SOD1, UQCR10, C3, IDH3G, COX7B, DLD, DNAJB9, REEP5, YWHAG, PHYH, AIFM1, GRPEL1, ACO2, IMMT, UBQLN1"
HALLMARK_ALLOGRAFT_REJECTION,0.010917460621169744,0.02219390754446912,0.03269532742642023,0.4576585664826539,1.3516069487360542,193,"ICOSLG, CDKN2A, BRCA1, IKBKB, LCP2, CSK, FGR, EGFR, CD1D, CD4, CD28, RPS19, CD47, WAS, STAT1, TNF, IRF7, ETS1, IL9, FLNA, HDAC9, FCGR2B, GZMB, CD8B, TLR6, GZMA, INHBB, MAP3K7, ZAP70, CD79A, CD96, CSF1, GBP2, NCK1, IL12A, ELF4, IL18RAP, IFNAR2, APBB1, TLR3, TIMP1, CFP, IL4"
HALLMARK_ANDROGEN_RESPONSE,8.8037801541905e-4,0.0029191481563894815,0.10857377462914608,0.6062973785733262,1.6395365688050152,95,"CDK6, AZGP1, ALDH1A3, PGM3, ELL2, ADAMTS1, HPGD, APPBP2, ARID5B, CDC14B, SCD, NDRG1, SGK1, CCND1, SLC26A2, STK39, SLC38A2, PLPP1, DBI, GNAI3, MAP7, UBE2J1, INSIG1, CENPN, ZMIZ1, MAF, MYL12A, TMPRSS2, PTPN21, STEAP4, IDI1, MAK, LMAN1, ELOVL5, NCOA4, ELK4, UBE2I"
HALLMARK_ANGIOGENESIS,0.09160929967803333,0.14730884358896634,0.009842613869181005,0.5786603732761043,1.3247071993218171,35,"FGFR1, POSTN, VCAN, PTK2, NRP1, PDGFA, TNFRSF21, COL5A2, KCNJ8, COL3A1, CXCL6, SPP1, TIMP1, VAV2, FSTL1"
HALLMARK_APICAL_JUNCTION,9.454874111531023e-7,5.9565706902645445e-6,0.6594443980379349,0.5963745838893361,1.7594126654900923,191,"VWF, LAMA3, PECAM1, LDLRAP1, JAM3, SDC3, NFASC, LAYN, CERCAM, MYL9, VCAN, FBN1, PTK2, GNAI1, ICAM2, CLDN11, ITGA9, DLG1, EGFR, AKT2, CLDN5, CD34, ICAM4, CTNNA1, ITGB1, NECTIN1, TIAL1, TJP1, LIMA1, CLDN15, ITGA2, CDH1, COL16A1, SORBS3, CD276, INSIG1, NF2, SKAP2, ACTN4, PBX2, STX4, CNTN1, JUP, NLGN3, FLNC, MPZL2, TRAF1, CDSN, INPPL1, SRC, BAIAP2, BMP1, VCL, PLCG1, SHC1, PCDH1, RRAS, GAMT, ZYX, ITGA10, IRS1, MYH9, TRO, RASA1"
HALLMARK_APICAL_SURFACE,0.010920811648865759,0.02219390754446912,0.029325990252273608,0.6509249787687191,1.5491552604018899,43,"BRCA1, MAL, ADIPOR2, EPHB4, AFAP1L2, MDGA1, GAS1, DCBLD2, ATP8B1, SULF2, SRPX, GATA3, B4GALT1"
HALLMARK_APOPTOSIS,0.006451123254401943,0.01451502732240437,0.041780640620969034,0.4888776562124222,1.4140576994925993,160,"TXNIP, ERBB3, PLAT, PSEN1, SATB1, BRCA1, RELA, TIMP2, GSN, BGN, ROCK1, PTK2, DPYD, LMNA, DFFA, BCL2L11, ATF3, CCND1, LEF1, CFLAR, SMAD7, ISG20, PDGFRB, DCN, JUN, ADD1, CASP2, PEA15, TNF, PMAIP1, FEZ1, TNFRSF12A, GNA15, CASP8, RARA, SQSTM1, BTG3, BTG2, BNIP3L, RETSAT, TSPO, CD44, CASP9, BMP2, CTNNB1, CASP3, CDK2, RHOB, TOP2A, MCL1, BMF, GADD45B, TGFBR3, HGF, CDKN1B, IRF1, CASP4, SLC20A1, IFITM3, TIMP1"
HALLMARK_BILE_ACID_METABOLISM,0.021741225156326864,0.03804714402357201,0.021940852449568737,0.49797026499475583,1.372770274106792,109,"NPC1, DIO2, SLCO1A2, PAOX, ABCA8, ABCA2, NEDD4, ACSL1, LIPE, HSD17B4, AR, HSD17B11, CYP27A1, RBP1, SULT1B1, NR1H4, ABCD1, RXRA, PEX6, CAT, CYP39A1, NR1I2, ABCA9, AMACR, NUDT12, ABCA3, RETSAT, SLC23A2, IDI1, ALDH1A1, ATXN1, SULT2B1, TFCP2L1, FADS2, GSTK1, HAO1, IDH2"
HALLMARK_CHOLESTEROL_HOMEOSTASIS,0.4690863303841587,0.5439067547336783,0.004132842323472384,0.3797832183240315,0.983763368876818,71,"LSS, GUSB, ACSS2, GNAI1, SCD, ABCA2, ATF3, ADH4, CD9, TP53INP1, ATXN2, CPEB2, ANTXR2, TNFRSF12A, FDFT1, ECH1, ANXA5, ALCAM, IDI1, CTNNB1, TRIB3, FADS2, DHCR7, CBS"
HALLMARK_COAGULATION,0.03030606384716302,0.05024426374661238,0.018913489238259067,0.4641059820461065,1.3168045409067903,136,"VWF, PECAM1, PLAT, TF, LAMP2, FN1, KLF7, GSN, FBN1, SIRT2, MAFF, CPB2, CPQ, F2RL2, CSRP1, CD9, HPN, C1S, ITGA2, HNF4A, FYN, FGA, PRSS23, HTRA1, A2M, F10, RAPGEF3, FGG, FURIN, C1R, MST1, THBS1, BMP1, MMP15, CASP9, PDGFB, CTSK, CTSV, CFI, PLAU, WDR1, MMP8"
HALLMARK_COMPLEMENT,0.006722736509370061,0.01460456552035565,0.04176304755581298,0.4669630882602124,1.381393339450069,196,"COL4A2, RHOG, PLAT, CD55, PSEN1, LIPA, CDA, LAMP2, FN1, TIMP2, ERAP2, LCP2, CR1, MAFF, CA2, CPQ, DOCK10, CSRP1, GNG2, C1S, ZEB1, PSMB9, KCNIP3, DOCK9, PRDM4, CBLB, GNAI3, HNF4A, DOCK4, WAS, FYN, CPM, IRF7, CASP10, RAF1, STX4, GZMB, F10, CR2, EHD1, C1R, L3MBTL4, ANXA5, NOTCH4, GZMK, GZMA, GCA, SRC, MSRB1, DGKH, MMP15, APOBEC3G, CDH13, CASP9, PDGFB, BRPF3, CASP3, TNFAIP3"
HALLMARK_DNA_REPAIR,0.7449603792537163,0.7822083982164021,0.003268960649917507,0.31481880961804,0.8986634104391119,143,"TYMS, ADA, POLA1, NELFCD, CDA, XPC, POLR2F, ERCC1, ADCY6, RFC3, TP53, TAF1C, COX17, RAD52, GTF3C5, POLH, ERCC5, BCAM, TAF10, PCNA, SMAD5, STX3, POLD3, UMPS, DDB2"
HALLMARK_E2F_TARGETS,0.02166772413096087,0.03804714402357201,0.02313572229203305,0.4418098402357844,1.3034187734486598,191,"TMPO, NASP, CCP110, MCM7, CDKN2A, SRSF1, TFRC, BRCA1, CDK1, MCM5, LMNB1, STMN1, SMC6, DDX39A, GINS4, TIMELESS, BARD1, NCAPD2, PAICS, AK2, RFC3, SMC1A, TP53, LBR, CBX5, STAG1, GSPT1, CDKN2C, CNOT9, EZH2, MCM6, PCNA, EXOSC8, DCLRE1B, PHF5A, MKI67, MTHFD2, CDK4, SYNCRIP, POLD3, CHEK1, CDC25A, ING3, TOP2A, TCF19, LUC7L3, ILF3, PNN, PAN2, POLA2, SMC4, DEPDC1, CDKN1B, MLH1, AURKA, RPA1, PDS5B, CDC20, HMMR, NUP107, PPM1D, RRM2, BIRC5, RFC1, E2F8, HMGB3, IPO7, ORC2, DNMT1, PLK4, PSIP1"
HALLMARK_EPITHELIAL_MESENCHYMAL_TRANSITION,7.436559641243737e-8,9.370065147967108e-7,0.7049757151672383,0.6223898073406251,1.841184359143291,196,"LAMA2, LAMA3, GREM1, COL4A2, MCM7, SFRP1, MYLK, PLOD3, CALD1, WNT5A, SGCD, POSTN, SLC6A8, SPOCK1, FOXC2, WIPF1, FN1, TPM2, COL1A2, MYL9, BGN, VCAN, FBN1, EDIL3, FBLN1, THBS2, PMP22, IGFBP3, EFEMP2, TAGLN, ACTA2, PLOD1, TPM4, ITGB1, VIM, PDGFRB, LOX, DKK1, DCN, NOTCH2, ELN, JUN, LAMA1, ITGB5, ITGA2, COL16A1, SERPINH1, ANPEP, GAS1, HTRA1, LOXL1, FLNA, TNFRSF12A, COL5A2, AREG, SFRP4, COL11A1, COL6A3, CTHRC1, COL4A1, CADM1, P3H1, LGALS1, COPA, DAB2, COL6A2, TGM2, THBS1, NT5E, BMP1, DST, COL3A1, CXCL8, CXCL6, LAMC1, TNC, CD44, COL12A1, SGCG, TNFAIP3, FERMT2, RHOB, VEGFC, SNAI2, SPP1, GADD45B, NID2"
HALLMARK_ESTROGEN_RESPONSE_EARLY,5.297714656071238e-4,0.0019387081917422858,0.14918530723110265,0.5186550096217991,1.5325063392092972,194,"SLC16A1, GAB2, SLC7A5, SLC2A1, FOXC1, NADSYN1, PODXL, NCOR2, MYBL1, SVIL, ENDOD1, MYOF, MAST4, HR, AFF1, KDM4B, AR, PPIF, CCND1, FLNB, DEPTOR, SLC26A2, DLC1, ITPK1, STC2, KAZN, FCMR, RHOBTB3, ISG20L2, PRSS23, PMAIP1, KLF4, RPS6KA2, WWC1, TJP3, AREG, SLC22A5, FDFT1, SLC7A2, ELF1, RARA, CLIC3, FARP1, OVOL2, TGM2, SLC39A6, INHBB, CYP26B1, ABCA3, MAPT, SYNGR1, CD44, SNX24, ZNF185, IL17RB, AQP3, ADD3, SULT2B1, SCARB1, RAB31, TIPARP, SYT12, ELOVL5, GLA, SH3BP5, LRIG1, HES1, DHCR7, ELF3"
HALLMARK_ESTROGEN_RESPONSE_LATE,0.13176910604014713,0.19305706233788997,0.009223894414876355,0.3855890064893799,1.1412519314396388,197,"LSR, SLC16A1, GPER1, PLXNB1, SLC7A5, FOXC1, EMP2, NCOR2, MYOF, CA2, HR, AFF1, PPIF, SGK1, CCND1, FLNB, CD9, SLC26A2, ITPK1, ISG20, DLG5, TST, CDH1, AGR2, SLC2A8, PRLR, PRSS23, KLF4, RPS6KA2, TJP3, AREG, SLC22A5, FDFT1, CLIC3, BTG3, FARP1, OVOL2, ASCL1, CYP26B1, ABCA3, MAPT, CD44, IL17RB, ADD3, TOP2A, METTL3, SULT2B1, SCARB1, RAB31, ELOVL5, GLA, SCUBE2, JAK1, PTGER3, IDH2, DHCR7, KLK11"
HALLMARK_FATTY_ACID_METABOLISM,0.6461568229091085,0.7141733305837515,0.0036262999315241086,0.32339374250679725,0.9306220485173466,153,"TP53INP2, XIST, ACSM3, HPGD, ADIPOR2, CBR1, CA2, ACSL1, HSD17B4, HSD17B11, CD1D, ACSL4, SDHD, AADAT, EPHX1, TDO2, ACSS1, SUCLG1, ACADVL, HSDL2, GPD1, ACAA2, SLC22A5, PPARA, LGALS1, ECH1, G0S2, SDHC, CPT1A, MAOA, AOC3, HSD17B10, RETSAT, GRHPR, IDI1, CPOX, UROS, RDH11, ALDH1A1, ADH7, ELOVL5, HADHB, KMT5A, CPT2"
HALLMARK_G2M_CHECKPOINT,6.493408934979353e-8,9.370065147967108e-7,0.7049757151672383,0.6385218885243482,1.8793243744571664,187,"MEIS1, TMPO, NASP, SMARCC1, SLC7A5, ABL1, FOXN3, SRSF1, SLC12A2, SLC7A1, CDK1, MCM5, LMNB1, STMN1, DDX39A, BARD1, G3BP1, CENPF, KIF5B, CCND1, SMC1A, PML, LBR, NOTCH2, MTF2, STAG1, CCNT1, GSPT1, NUMA1, CDKN2C, CHAF1A, FANCC, KNL1, EZH2, MCM6, UPF1, TLE3, BUB3, PRC1, RBM14, CUL4A, DTYMK, MKI67, NUP98, CCNA2, UBE2C, CDK4, SYNCRIP, DR1, CHEK1, SFPQ, RBL1, CDC25A, LIG3, TOP2A, CHMP1A, ILF3, PURA, POLA2, SMC4, KMT5A, CDKN1B, PTTG3P, YTHDC1, AURKA, RAD54L, PDS5B, CDC20, HMMR"
HALLMARK_GLYCOLYSIS,0.003949046023310655,0.009951595978742851,0.054510057622735336,0.4785334771515376,1.41475230162673,195,"SLC25A13, LHPP, NASP, MET, CHST6, SDC3, GUSB, ANGPTL4, EGLN3, CDK1, VCAN, UGP2, NOL3, STMN1, GAL3ST1, B4GALT2, TGFA, AGRN, EGFR, IGFBP3, PLOD1, COG2, ISG20, STC2, RBCK1, MXI1, SRD5A3, ZNF292, FUT8, DCN, PKM, CHST12, ALDOB, PYGB, TALDO1, GYS1, IL13RA1, ANKZF1, SDHC, NT5E, GALK2, CXCR4, XYLT2, CD44, G6PD, DSC2, EXT1, B3GAT1, SOX9, DEPDC1, DDIT4, ELF3, AURKA, PGLS, PPIA, TKTL1, HMMR"
HALLMARK_HEDGEHOG_SIGNALING,0.14052477093686155,0.19673467931160615,0.007868247940478218,0.544578462685833,1.2535318495652295,36,"NRP2, CDK6, UNC5C, NRP1, HEY2, PML, TLE3, PTCH1, MYH9, SLIT1, RASA1"
HALLMARK_HEME_METABOLISM,6.713061957626566e-7,5.286536291630921e-6,0.6594443980379349,0.6133872437334748,1.808603548940034,190,"HBB, KHNYN, HTATIP2, TNS1, SLC2A1, ELL2, MBOAT2, TFRC, AGPAT4, SLC6A8, LAMP2, VEZF1, LRP10, SLC25A37, EZH1, NEK7, ENDOD1, SLC10A3, SLC11A2, CA2, ICAM4, DAAM1, SLC4A1, CAST, FTCD, KLF3, MXI1, SIDT2, TMCC2, CTNS, ALAS2, GDE1, ALDH6A1, AHSP, DCUN1D1, EPOR, ANK1, KDM7A, RIOK3, ADD1, BACH1, FECH, HBD, TRAK2, ABCG2, CAT, TFDP2, GAPVD1, BCAM, NR3C1, HMBS, PPOX, BTG2, PICALM, CROCCP2, TAL1, UCP2, BNIP3L, MOCOS, EPB42, SLC6A9, EIF2AK1, CPOX, UROS, AQP3, FBXO7, RBM5, RHAG, NCOA4"
HALLMARK_HYPOXIA,0.0012849775974300448,0.0036797085744587647,0.09562791003349888,0.5008832143512606,1.4799947690789133,194,"CDKN1C, SDC3, SLC2A1, EFNA1, AMPD3, SLC6A6, ANGPTL4, KLF7, RBPJ, BGN, UGP2, TGFB3, ATP7A, MAFF, NDRG1, EGFR, IGFBP3, NEDD4L, MAP3K1, ATF3, TES, ISG20, STC2, MXI1, JMJD6, ZNF292, CHST3, LOX, DCN, DUSP1, JUN, WSB1, NDST1, PCK1, ETS1, ALDOB, PRKCA, PYGM, GYS1, NR3C1, KLF6, ANKZF1, TGM2, BNIP3L, CXCR4, GRHPR, CCNG2, BCAN, PPP1R3C, PDGFB, GCNT2, TNFAIP3, SULT2B1, SCARB1, EXT1, TIPARP, PLIN2, MYH9, DDIT4, CDKN1B, SRPX, SDC4, PPARGC1A, KDM3A, TKTL1"
HALLMARK_IL2_STAT5_SIGNALING,7.826848235385611e-7,5.478793764769927e-6,0.6594443980379349,0.60791302668962,1.7972543087631465,195,"CDKN1C, HIPK2, RABGAP1L, IKZF4, CAPN3, MYO1E, DENND5A, ITGA6, CDC42SE2, GPR83, GLIPR2, CKAP4, SYNGR2, MAFF, ABCB1, NDRG1, CA2, F2RL2, NRP1, SNX9, IL1RL1, SPRY4, MAPKAPK2, NCS1, IL18R1, ST3GAL4, ETFBKMT, IKZF2, PLPP1, TNFRSF21, SERPINB6, ADAM19, MXD1, PTGER2, SPRED2, ANXA4, SHE, ITIH5, HOPX, COL6A1, KLF6, NOP2, NCOA3, TRAF1, FURIN, SOCS2, CD48, SMPDL3A, TGM2, PTH1R, NT5E, AMACR, RNH1, ALCAM, SLC39A8, UMPS, CD44, CCR4, BMP2, GBP4, CSF1, SELL, CASP3, IL1R2, RHOB, AHNAK, SPP1, CSF2, GADD45B, PTCH1, PLIN2, LRIG1, SWAP70, POU2F1"
HALLMARK_IL6_JAK_STAT3_SIGNALING,0.0019741494460595583,0.005182142295906341,0.07197094625210573,0.5986175117914124,1.598490662653982,87,"IL1R1, ITGA4, ACVRL1, CD9, IL18R1, TNFRSF1A, JUN, TNFRSF21, STAT1, PTPN1, TNF, OSMR, LEPR, A2M, TNFRSF12A, CSF3R, TYK2, PTPN2, IL13RA1, STAT2, IL10RB, CD44, STAT3, CSF1, IL17RB, IL1R2, CSF2, IRF1, CRLF2, CBL"
HALLMARK_INFLAMMATORY_RESPONSE,3.7093889108604396e-8,7.789716712806923e-7,0.7195128263389107,0.6262519960871649,1.8556260012371542,199,"P2RX7, ICOSLG, SEMA4D, LPAR1, SLC31A2, TNFAIP6, RNF144B, RHOG, MET, CD55, PSEN1, TACR1, KCNJ2, SLC7A1, RELA, LCP2, IL1R1, BEST1, SLC11A2, IFITM1, HBEGF, ICAM4, FZD5, HPN, IL18R1, KCNMB2, RTP4, TNFSF9, NFKB1, GNAI3, IRAK2, MXD1, IRF7, PTGER2, OSMR, RAF1, PROK2, DCBLD2, KIF1B, CSF3R, KLF6, SLC7A2, GNA15, NAMPT, SLC28A2, BTG2, CD48, SLAMF1, EDN1, PTGER4, PCDH7, CXCL8, AXL, CXCL6, CCL17, SELE, CSF1, SELL, ROS1"
HALLMARK_INTERFERON_ALPHA_RESPONSE,2.1956321592992362e-7,2.305413767264198e-6,0.6901324587967956,0.7322225082873899,1.9706969741399658,92,"CNP, TXNIP, TMEM140, IFIT2, TRAFD1, LGALS3BP, PNPT1, IFI44L, IFI27, IFITM1, NUB1, C1S, ISG20, IFI44, PSMB9, IFITM2, RTP4, SLC25A28, PARP12, IFIH1, CD47, IRF7, EPSTI1, SAMD9L, IFI35, PARP14, ELF1, CASP8, STAT2, TRIM26, PSMA3, GBP4, CSF1, SELL, GBP2, BST2, IRF1, IFITM3, IRF9, OASL, TRIM14, TDRD7, SP110, BATF2, TRIM5, TAP1, PARP9"
HALLMARK_INTERFERON_GAMMA_RESPONSE,5.493921773432506e-7,4.944529596089255e-6,0.6594443980379349,0.6047061052108691,1.7867675476035183,194,"TXNIP, LATS2, TNFAIP6, RNF213, IFIT2, TRAFD1, LGALS3BP, PNPT1, LCP2, OAS2, IFI44L, IFI27, ZNFX1, ARID5B, PML, C1S, ISG20, RBCK1, IFI44, PSMB9, IFITM2, RTP4, SLC25A28, PARP12, IFIH1, NFKB1, AUTS2, NOD1, STAT1, PTPN1, IRF7, IRF5, EPSTI1, SAMD9L, IFI35, PARP14, PTPN2, P2RY14, CASP8, NAMPT, NCOA3, STAT2, C1R, GZMA, PSMB2, SAMHD1, RAPGEF6, MTHFD2, TRIM26, APOL6, PSMA3, GBP4, PTGS2, STAT3, CASP3, TNFAIP3, ZBP1, GBP6, FCGR1A, IFNAR2, BST2, IRF1, CASP4, NLRC5, IFITM3, CIITA, SSPN, PDE4B, IRF9, OASL, TNFSF10, TRIM14, TDRD7, SP110, BATF2"
HALLMARK_KRAS_SIGNALING_DN,0.020703572954376814,0.03804714402357201,0.023686339705881906,0.44260848982293166,1.3064125542637302,192,"RYR2, MYOT, SOX10, EFHD1, RGS11, PDE6B, TCF7L1, DTNB, CPB1, KMT2D, IFI44L, BARD1, SGK1, NGB, GTF3C5, VPS50, CDKAL1, SKIL, CYP39A1, SHOX2, SLC25A23, CAPN9, GDNF, PTGFR, SPHK2, C5, BTG2, NR6A1, EDN1, CYP11B2, NOS1, MFSD6, GAMT, KCNMB1, ZBTB16, COPZ2, PLAG1, SLC16A7, TFCP2L1, UPK3B, GPRC5C, IRS4, ATP4A, ABCB11, ARPP21, GPR3, SLC29A3, ITIH3, TSHB, NRIP2, TG"
HALLMARK_KRAS_SIGNALING_UP,0.015358997516369384,0.030238026360352225,0.02758452109751324,0.4478849132198904,1.3249553369780673,196,"PECAM1, HSD11B1, RABGAP1L, PLAT, SATB1, ALDH1A3, GPRC5B, ANGPTL4, TRIB2, MTMR10, USH1C, ADGRA2, ABCB1, CA2, SDCCAG8, ENG, IGFBP3, AKT2, NRP1, HBEGF, MAP3K1, GNG11, AMMECR1, STRN, NR1H4, ANXA10, ADGRL4, ITGA2, MAP7, KLF4, ETS1, HDAC9, KIF5C, DCBLD2, CD37, JUP, PRDM1, PPBP, MPZL2, TRIB1, TRAF1, ETV5, MYCN, G0S2, CXCR4, EPHB2, BTBD3, BMP2, ZNF277, PTGS2, DNMBP, TNFAIP3, SPP1, CSF2, CFHR2, SOX9, CBR4"
HALLMARK_MITOTIC_SPINDLE,4.536291189051946e-14,2.857863449102726e-12,0.9653277542260832,0.7197791615510261,2.1315694432350236,198,"CDK5RAP2, ANLN, SORBS2, CTTN, ABL1, PCGF5, MYO9B, ARHGAP29, PREX1, SPTBN1, CDC42EP1, SHROOM1, SUN2, CCDC88A, MAP3K11, MYO1E, BIN1, PXN, CDK1, WASF2, GSN, MID1IP1, ROCK1, LMNB1, MAPRE1, CDC42BPA, CDC42EP2, DLG1, CLIP2, CENPF, ALMS1, BCL2L11, RICTOR, LRPPRC, KIF5B, PKD2, FLNB, SMC1A, ARHGAP5, CYTH2, RAPGEF5, HDAC6, SOS1, NOTCH2, RABGAP1, KLC1, LLGL1, ECT2, BCAR1, STAU1, DOCK4, CEP250, NUMA1, NET1, ACTN4, FLNA, KIF1B, FGD4, ARHGEF2, PRC1, CNTRL, FARP1, ITSN1, TUBGCP6, SSH2, ARHGEF7, RAPGEF6, DST, VCL, PLEKHG2, MID1, NCK2"
HALLMARK_MTORC1_SIGNALING,0.24464438972126706,0.3145427867844863,0.00660010639950626,0.36421333150618407,1.0739015697880727,190,"QDPR, SLC7A5, SLC2A1, TFRC, SYTL2, SLC6A6, EGLN3, ABCF2, ADIPOR2, POLR3G, SSR1, DDX39A, SCD, SHMT2, TES, CD9, DAPP1, EIF2S2, RIT1, ACLY, INSIG1, SERPINH1, SKAP2, ACTR3, TXNRD1, PHGDH, HMBS, NAMPT, SQSTM1, BTG2, NFKBIB, MTHFD2, CXCR4, IDI1, CDC25A, G6PD, PSMA3, RDH11, GGA2, ADD3, PSAT1, TRIB3, ELOVL5, FADS2, GLA, SEC11A, DDIT4, GMPS, IGFBP5, DHCR7, AURKA, RPA1, CFP, PPIA"
HALLMARK_MYC_TARGETS_V1,0.6860256969999377,0.7325359137456962,0.002301928091536119,-0.3301148409902059,-0.9115927824390917,185,"RAN, C1QBP, POLE3, NDUFAB1, NHP2, SSB, PSMA1, PSMD8, LSM7, TOMM70, PSMC6, NCBP2, PSMB3, CYC1, LDHA, COX5A, PSMD7, HSPE1, HSP90AB1, SNRPD2, NME1, PGK1, PSMA4, RSL1D1, CCT7, PSMD1, GLO1, CCT2, MAD2L1, MRPL9, PWP1, SLC25A3, SRM, HDAC2, RPL6"
HALLMARK_MYC_TARGETS_V2,0.9030957331547446,0.9030957331547446,0.0019794753082643325,-0.3188657807600225,-0.7549251531630217,55,"NDUFAF4, EXOSC5, BYSL, HSPE1, IMP4, MYBBP1A, FARSA, SRM, DUSP2"
HALLMARK_MYOGENESIS,2.1449537141566945e-4,8.445755249491984e-4,0.23557529971171318,0.5319910671026487,1.573762327726043,196,"LDB3, LAMA2, CASQ2, MYH11, ERBB3, COL4A2, NCAM1, MYLK, SGCD, SLC6A8, BIN1, SMTN, TPM2, EFS, GSN, SIRT2, SVIL, SYNGR2, SCD, CRYAB, AGRN, FLII, IGFBP3, AKT2, HBEGF, ACSL1, TAGLN, COL15A1, HDAC5, ITGB1, STC2, DAPK2, ITGB5, RIT1, SORBS3, NOTCH1, MYL1, SGCA, PYGM, COL6A3, DMPK, COX6A2, COL6A2, PICK1, ATP2A1, CKMT2, COL3A1, NOS1, MYBPH, PPP1R3C, CDH13, GJA5, FOXO4, FST, SGCG, MYH3, PLXNB2, GNAO1, HRC, GADD45B, MYH9, KIFC3"
HALLMARK_NOTCH_SIGNALING,0.005491410870177415,0.012813292030413969,0.04079545594503129,0.7264693690847414,1.624621638101965,31,"NOTCH3, WNT5A, DLL1, CCND1, FZD5, MAML2, TCF7L2, NOTCH2, PPARD, KAT2A, NOTCH1, PRKCA"
HALLMARK_OXIDATIVE_PHOSPHORYLATION,7.819293010803135e-5,3.78934968985075e-4,0.29144105040995055,-0.5979246025509124,-1.6474062686141138,181,"ISCU, TIMM10, NDUFA4, SLC25A4, PDP1, MDH1, DLAT, COX8A, UQCRFS1, GPX4, NDUFB5, GPI, NDUFAB1, SUCLA2, ALAS1, SLC25A6, COX7A2L, NDUFS3, TOMM70, MDH2, HCCS, ATP6V1E1, MRPL34, MRPL15, NDUFA1, COX6C, UQCRQ, CYC1, LDHA, ATP6V1C1, ATP6V0C, NDUFS6, VDAC2, COX5A, UQCRB, SLC25A5, UQCRC1, NDUFA8, IDH3B, ATP6AP1, ISCA1, ETFA, COX7C, COX7A2, CYCS, UQCR10, LDHB, COX6B1, IDH3G, COX7B, DLD, NDUFB3, PDHB, UQCRC2, PHYH, AIFM1, MRPL11, CASP7, GRPEL1, ACO2, IMMT, PDHX, TIMM9, SLC25A3, ATP6V0B, MTX2, NDUFB2, MRPL35, NDUFS2, ATP6V1D, FH, NDUFA6, NDUFV2, SLC25A11"
HALLMARK_P53_PATHWAY,1.907208687896517e-4,8.010276489165372e-4,0.2492421363189237,0.5374978379847156,1.584839768446753,190,"TXNIP, KIF13B, CCP110, ADA, NHLH2, CDKN2A, MDM2, SERTAD3, TRAFD1, TRAF4, CLCA2, MKNK2, RALGDS, PIDD1, TGFA, NDRG1, DRAM1, XPC, HBEGF, PDGFA, ATF3, STEAP3, TP63, SP1, RRP8, TP53, GM2A, CDKN2B, JUN, TNFSF9, EPHX1, POLH, ABCC5, MXD1, RXRA, ABHD4, KLF4, NOTCH1, ERCC5, PCNA, IRAK1, PTPN14, BTG2, VDR, RPL18, INHBB, RAP2B, PHLDA3, BAIAP2, MAPKAPK3, RETSAT, TCN2, DDB2, HEXIM1, NOL8, CDH13, BMP2, ZBTB16, PLXNB2, TRIB3, GPX2, DDIT4, CCNK, SEC61A1, TM4SF1, RPS12"
HALLMARK_PANCREAS_BETA_CELLS,0.7854217383018278,0.8111732707051664,0.0023165221762903167,-0.35936410079685505,-0.8085982299259649,40,"PCSK1, SRP14, PCSK2, STXBP1, SRP9, NKX6-1, SPCS1"
HALLMARK_PEROXISOME,0.1289609099936806,0.19305706233788997,0.008762705894930242,0.4359655492291771,1.1891649818587477,101,"SMARCC1, SEMA3C, CRABP2, ABCB1, CLN8, ACSL1, HSD17B4, ERCC1, HSD17B11, ACSL4, ABCD1, IDE, ABCC5, PEX6, CAT, CADM1, NR1I2, ECH1, PEX2, RETSAT, TSPO, SLC23A2, IDI1, ESR2, RDH11, ALDH1A1, TOP2A, ATXN1, SULT2B1, ELOVL5, GSTK1, IDH2"
HALLMARK_PI3K_AKT_MTOR_SIGNALING,0.16300910397700047,0.2232515989250224,0.007761381827277586,0.4217847815195783,1.1550423776811551,104,"PRKAR2A, SLC2A1, SMAD2, CDK1, MKNK2, EGFR, ADCY2, DAPP1, TNFRSF1A, CFL1, RIT1, NOD1, ACTR3, RAF1, MAPK8, STAT2, SQSTM1, RPS6KA1, MKNK1, NFKBIB, CXCR4, FGF6, PLCG1, CDK4, MAP3K7, CDK2, NCK1, TRIB3"
HALLMARK_PROTEIN_SECRETION,0.11206167619995026,0.1721923317218748,0.009392626274305477,0.4482768897526298,1.2122208996335337,95,"TSPAN8, VAMP3, LAMP2, ATP7A, SNAP23, EGFR, MON2, GNAS, COG2, CAV2, STX16, GALC, RAB14, VAMP7, KIF1B, AP1G1, YIPF6, GOSR2, DST, GOLGA4, CLN5"
HALLMARK_REACTIVE_OXYGEN_SPECIES_PATHWAY,0.8123325257864406,0.8254346632991251,0.002755646954871314,0.3363595735791859,0.8163734777091087,48,"MBP, NDUFB4, TXNRD1, CAT, OXSR1, SCAF4, HHEX, G6PD, ERCC2, PTPA"
HALLMARK_SPERMATOGENESIS,0.42416047461772116,0.5041907528474798,0.0034221128825046966,-0.3793773882374304,-1.010656327484119,132,"SCG3, ART3, IL13RA2, CLVS1, RPL39L, NPY5R, DDX25, SCG5, CHRM4, CCNA1, HSPA4L, CAMK4, ACTL7B, CLGN, SNAP91, PARP2"
HALLMARK_TGF_BETA_SIGNALING,9.989316980451462e-4,0.0031466348488422106,0.09825550708780229,0.6915418885809954,1.7020333211841103,52,"CDKN1C, HIPK2, SPTBN1, ID1, NCOR2, FNTA, ENG, SMAD6, SMAD7, BMPR1A, TJP1, CDH1, HDAC1, SKIL, SKI, FURIN, THBS1, MAP3K7, ID3, LTBP2, PPM1A, BMP2, ARID4B, CTNNB1, RAB31, SMURF1, SLC20A1, CDK9"
HALLMARK_TNFA_SIGNALING_VIA_NFKB,0.0011609885310113564,0.003482965593034069,0.10061875316928569,0.5028110069143571,1.4856909529946538,194,"ICOSLG, TNFAIP6, TNIP2, IFIT2, EFNA1, RELA, DENND5A, SPSB1, LITAF, MAFF, DRAM1, HBEGF, ATF3, SGK1, CCND1, CFLAR, KLF2, REL, SIK1, DUSP1, JUN, TNFSF9, IFIH1, NFKB1, MXD1, TNF, KLF4, AREG, KLF6, TRIB1, NFE2L2, NAMPT, TRAF1, EHD1, SQSTM1, BTG3, BTG2, G0S2, CCNL1, EDN1, PTGER4, CXCL6, SERPINB8, TNC, CD44, BMP2, PTGS2, CSF1, TNFAIP3, RHOB, MCL1, BCL6, CSF2, TIPARP, GADD45B"
HALLMARK_UNFOLDED_PROTEIN_RESPONSE,0.4748392303230525,0.5439067547336783,0.004236241105350386,0.35910436517386934,0.9833943232654416,104,"SLC7A5, SSR1, ERN1, NFYA, ATF3, KIF5B, KHSRP, POP4, STC2, DCP2, EXOSC1, WIPI1, GOSR2, EIF2AK3, MTHFD2, CNOT2, SHC1, EXOSC10, EIF4EBP1, PSAT1, FKBP14, SEC11A, DDIT4"
HALLMARK_UV_RESPONSE_DN,2.363927443580339e-5,1.241061907879678e-4,0.5756102610711286,0.6179985963849786,1.7550290629372889,137,"SYNJ2, LPAR1, RBPMS, MET, WDR37, PLCB4, PRDM2, ID1, SLC7A1, COL1A2, APBB2, CDC42BPA, NEK7, DLG1, PMP22, NRP1, MAP2K5, NFIB, DLC1, SMAD7, BMPR1A, NIPBL, TGFBR2, PDGFRB, TJP1, NOTCH2, DUSP1, MMP16, KALRN, NFKB1, FYN, RXRA, INSIG1, ZMIZ1, ANXA4, COL5A2, CDK13, PRKCA, COL11A1, NR3C1, PTGFR, DAB2, PIK3CD, PIAS3, COL3A1, PTPN21, LAMC1, ATRN, MAGI2, ADD3, ATXN1, SNAI2, IRS1, TGFBR3, IGFBP5, FZD2, CDKN1B, YTHDC1, DYRK1A"
HALLMARK_UV_RESPONSE_UP,0.6093145198193299,0.6854788347967462,0.0037718594026161303,0.32699958744847574,0.9416469051801933,154,"CNP, CDKN1C, SLC6A12, TFRC, PTPRD, HSPA2, SLC6A8, ABCB1, CA2, BCL2L11, PPIF, ATF3, WIZ, CDKN2B, PPP1R2, TST, EPHX1, PRKACA, PLCL1, NPTXR, MGAT1, TYRO3, SHOX2, SQSTM1, BTG3, FURIN, BTG2, CHRNA5, GLS, RAB27A, MAOA, NUP58, BMP2, AQP3, CASP3, CDK2, RHOB"
HALLMARK_WNT_BETA_CATENIN_SIGNALING,6.560794198113661e-6,3.757545768010552e-5,0.610526878385931,0.8105704977119628,1.9114616311221582,41,"NCOR2, RBPJ, HDAC11, GNAI1, MAML1, DLL1, SKP2, HEY2, LEF1, TP53, HDAC5, DKK1, PPARD, KAT2A, NKD1, NCSTN, NOTCH1, DVL2, CSNK1E, WNT1, FRAT1, NOTCH4, AXIN1, TCF7, CTNNB1, AXIN2, PTCH1"
HALLMARK_XENOBIOTIC_METABOLISM,1.4631648255175947e-4,6.584241714829176e-4,0.2856706066336653,0.5413439750800284,1.598755779877434,193,"HES6, NPC1, ENTPD5, HSD11B1, SLC46A3, AOX1, MTHFD1, ABHD6, SLC6A12, SLC6A6, CDA, MPP2, SAR1B, CBR1, IL1R1, FBLN1, CA2, SHMT2, CYP27A1, CCL25, ITIH4, TNFRSF1A, BCAR1, PPARD, HNF4A, XDH, DHRS1, CYP26A1, CYP2J2, EPHX1, TDO2, CAT, PDK4, JUP, F10, ECH1, ATOH8, GSTA3, TAT, MCCC2, COMT, MAOA, RETSAT, PTGDS, LEAP2, ACOX3, GCNT2"
SMITA_FA_OXIDATION,0.21840172624424858,0.2866522656955763,0.006359628961878714,0.45620768462066985,1.1437538862570187,58,"PCBP2, HSD3B2, ACSL1, HSD17B4, STEAP3, PCCB, DBI, PCCA, ACADVL, SLC22A5, ECH1, CPT1A, LPCAT3, HSD17B10, ACOX3, NCOA4, HADHB, CPT2, ECI1, ACADS, SLC25A20, ACOX1"
SMITA_FA_SYNTHESIS,0.0183165493096259,0.03496795777292217,0.023551412850309504,0.5307810670539723,1.4195188487920167,88,"LIPA, ELOVL7, ACSM3, SCARB2, LITAF, SCD, ABCA2, ACSL1, ARSG, GNS, MAN2B1, GM2A, ACSL4, ACACB, CTNS, OLAH, GALC, NPC2, ACADVL, ACSF2, CLN3, LAPTM4B, ACSM2A, CLN5, ACSF3, GGA2, ACSM2B, NAGLU, ELOVL5, CBR4, ACSM5, NAGA, HGSNAT, ACSL5, ACADS, ACACA, IGF2R"
SMITA_GLUCONEOGENESIS,0.1986555422249494,0.2662829608547194,0.006619329904470888,0.485186963603876,1.173074993001627,47,"SLC25A13, SLC16A1, SLC2A1, ACSS2, G6PC, ACLY, PCK1, PKM, ALDOB, GPD1"
SMITA_GLUTAMATE_RECEPTORS,5.539166262120816e-4,0.0019387081917422858,0.1533423640708849,0.47141979501071835,1.44973908372496,293,"GNRH1, SUPT3H, GPER1, GAB2, IL3, RXFP2, TACR1, NAPEPLD, ABHD6, ETV6, MYL9, RALGAPA1, SIPA1L2, GRIN2D, SIPA1, NFYA, AFF1, DOT1L, RUNX1T1, GRIN2A, ADCY6, KLF3, C1S, RAPGEF5, FARP2, GLI3, REL, FUT8, GIPR, GPSM1, FAAH, TBXA2R, DOCK4, KDM6A, RGL1, RUNX2, MAF, C6, OMA1, GZMB, RAPGEF3, GNRHR, ADORA1, NR3C1, PLCE1, MYCN, PTGFR, C1R, SPHK2, SIPA1L3, DAB1, AFDN, KMT2A, GRID1, PUM2, PTH1R, RAPGEF6, LTB4R, TSPO, UTS2, GRIK5, ARAP3, MAP3K2, FOXO4, GNA12, SSX1, ZBTB16, MAGI3, SOX9, GNB3, FCGR1A, CALCRL, TLX3, ELK4, APLN, AFG3L2, OPA1, CDK9, TAAR9, LYL1, EVL, GRM3, GRIA2, BRAP, PTGDR, ADRA1D"
SMITA_GLYCOGENESIS,2.9751179379564616e-11,9.371621504562854e-10,0.851339057116899,0.5885704137184549,1.8494578512863704,380,"PGM5, LATS2, SMARCC1, MCM7, KIDINS220, CD22, PREX1, SRSF1, PGM3, WNT5A, TBX3, FGFR2, S100A8, TBL1X, RGS3, STK3, TRAF4, NEO1, FRZB, HESX1, UGP2, MCM5, ARID2, MAVS, IQCE, ENAH, FGR, VANGL2, APCDD1, CDC14B, ROR1, ITGA4, IFITM1, RICTOR, NTN1, KAT6A, RIF1, FAT4, SMARCD1, SGK1, FRMD6, ZNF274, ARID1B, DAPP1, DEPTOR, SMAD7, ANAPC5, BAMBI, ZIC3, NTNG2, SOX17, IFIH1, SLC38A9, CFL1, FNIP2, PRDM4, CBLB, STAG1, SETDB1, G6PC, NODAL, WAS, CXXC4, NF2, SPOPL, KLF4, SKAP2, NKD1, CXCR2, LRIG2, SSH1, CDX2, SKIL, WWC1, FCGR2B, PLXNA1, AREG, LIMK1, SAV1, PYGB, PYGM, CD200R1, PBRM1, GRB10, GYS1, MCM6, IRAK3, PCNA, CR2, ARHGEF7, PHF10, CSN2, CTNNBIP1, RASSF4, SLAMF1, ABLIM3, NCK2, TP73, CXCL6, CCL17, ABCG1, SEMA7A, RYK, POU2F3, JARID2, EIF2AK1, DPYSL5, ZYX, CD79A, IL17RB, CCNB3, PLXNB2, SMARCE1, GNAO1, MUC5AC, SNAI2, CHD8, TEAD1, SLIT1, SCUBE2, RASA1"
SMITA_GLYCOGENOLYSIS,0.005274889181239997,0.01278146224685076,0.040616329114151084,0.8190460384914727,1.6179588179754874,17,"PGM5, GDE1, G6PC3, PYGB, PYGM, GYS1, PHKG2"
SMITA_GLYCOLYSIS,0.09352942450093102,0.14730884358896634,0.010784123356902636,0.4125477150558723,1.1924415220113704,159,"NKX2-2, PIP4K2A, FYCO1, PODXL, DNM2, ABCF2, GSN, INPP5B, PNPT1, INPP1, HPN, ITPK1, PATL1, KPNA1, STX10, PKM, DCP2, EDC3, EXOSC1, ALDOB, CNOT9, FOXA2, CNOT6L, LSM8, SNX18, MYO6, EXOSC8, BAIAP2L1, CNOT2, PLEKHM1, ARL8A, NEUROD1, EXOSC10, RHOB, GTF2E1, PAN2, PAN3, SP100, DDX3X, RHOJ, NR5A2, PLEKHM2, TMBIM6"
SMITA_HMP_SHUNT_GLUTATHIONE,0.13723865169367055,0.1965007967432101,0.008103495025900019,0.5047323766993057,1.2337939286847472,50,"LRP2, CBR1, RPIA, CYP2J2, ALOX12, CYP2C8, TALDO1, PDIA4, ALOXE3, IYD, G6PD, TKT, TKTL1, CYP2B6, TG"
SMITA_KETONE_BODY_SYNTHESIS,0.3963675491160047,0.48656818198394003,0.0039141928135853835,-0.5015858895108949,-1.0462178356864889,26,"OXCT1, HMGCS1, ELOVL4, ACAT2"
SMITA_LACTATE_SHUTTLE,0.023874420858978836,0.040651040922045044,0.02121874250322099,0.4778398409139225,1.3454042790246665,128,"ZEB2, SLC16A1, MDM4, SHC4, SLC2A1, SOX4, DNMT3A, SLC7A1, RDX, STMN1, KCNJ6, TP63, HDAC5, NR1H4, VIM, DICER1, MMP16, EPHX1, PLCL1, TRAK2, ABCG2, PDK4, SLC4A2, EZH2, GLS, HOXD10, FOXP1, TNC, RANBP3, SHC1, SLC10A1, BMF, SLC16A7"
SMITA_TCA_CYCLE,0.2714515329049677,0.3420289314602593,0.004942835587192362,-0.5601845012122485,-1.151082952322854,24,"MDH1, DLAT, SUCLA2, MDH2, IDH3B, IDH3G, DLD, ACO2"
