pathway,pval,padj,log2err,ES,NES,size,LEGenes
HALLMARK_ADIPOGENESIS,2.2666421113771268e-4,5.71193812067036e-4,0.16179071045089904,0.5841548332840043,1.615770547523822,191,"FABP4, COL4A1, SLC19A1, CD36, ATP1B3, AK2, ABCB8, CIDEA, GPX3, IDH1, PTCD3, PPARG, SLC27A1, UCK1, CMBL, SOWAHC, CRAT, ABCA1, FZD4, LIPE, ALDH2, HSPB8, LPCAT3, APLP2, ACAA2, SLC25A1, STAT5A, VEGFB, RREB1, GBE1, ELMOD3, ENPP2, PGM1, CHUK, GPD2, ACADS, HADH, ACOX1, RETN, SSPN, ANGPTL4, PRDX3, POR, PLIN2, ADCY6, ITSN1, HIBCH, ORM1"
HALLMARK_ALLOGRAFT_REJECTION,8.287605362900945e-4,0.0016842552834282565,0.08433043177508967,0.5621363677240199,1.5566034395436812,193,"CCL2, AKT1, IL4, ICAM1, GALNT1, CD96, EIF5A, CCL5, IL6, CD74, FLNA, TAP2, CDKN2A, IL12A, HLA-A, CSF1, HDAC9, LIF, NLRP3, CD28, CD8A, IL4R, TAP1, IL1B, STAB1, LYN, FAS, CD47, NOS2, IL27RA, PRKCB, TIMP1, B2M, CCL19, RIPK2, ITGB2, HLA-DOA, IL15, PTPRC, CCND2, CD80, IFNGR2, IRF7, HLA-E, RPS19, MMP9, STAT4, ICOSLG"
HALLMARK_ANDROGEN_RESPONSE,9.998572494688139e-7,3.4995003731408485e-6,0.6435518361507222,0.7391834184139403,1.8909266848442903,95,"SLC26A2, CCND1, TNFAIP8, ABHD2, AKT1, ABCC4, IDI1, HPGD, ADAMTS1, ELOVL5, SORD, XRCC5, MAK, ALDH1A3, ITGAV, PTPN21, ZBTB10, PGM3, MAF, HSD17B14, RPS6KA3, PTK2B, MYL12A, BMPR1B, UBE2I, PDLIM5, CAMKK2, B2M, CDC14B, HOMER2, AKAP12, INSIG1, B4GALT1, ARID5B, MERTK, KRT19, TMEM50A, ANKH, AZGP1"
HALLMARK_ANGIOGENESIS,5.69477989675699e-5,1.5598744934595236e-4,0.35510681481399964,0.8441741217064612,1.8625175987102562,35,"KCNJ8, JAG1, POSTN, THBD, COL3A1, FSTL1, CXCL6, MSX1, STC1, S100A4, PRG2, ITGAV, PTK2, APP"
HALLMARK_APICAL_JUNCTION,1.4729644039577604e-8,1.0310750827704322e-7,0.7477396631498854,0.685295935702798,1.8955265387798685,191,"TGFBI, NEXN, FBN1, CDH3, PPP2R2C, PARD6G, CDH1, ACTG2, JUP, ICAM1, COL9A1, MPZL2, SDC3, SORBS3, PECAM1, CDH6, VCL, GRB7, CNN2, PTEN, NECTIN3, MYL9, NRAP, CRAT, SLIT2, PARVA, ITGA3, BMP1, VCAM1, PTK2, CLDN6, PIK3R3, CLDN7, LAYN, VWF, ACTN4, SHC1, SIRPA, MPZL1, CLDN19, CTNNA1, LAMA3, AKT2, ACTC1, NFASC, RSU1, SRC, ITGA9, ITGA2, TJP1, VCAN, CD276, LIMA1, INSIG1, DLG1, B4GALT1, HADH, TSPAN4, PTPRC, MSN, NF2, ITGB4"
HALLMARK_APICAL_SURFACE,0.005538264523092054,0.00914896153878731,0.03516523426618423,0.708903877145506,1.6176150163481495,43,"GSTM3, PLAUR, HSPB1, GAS1, NTNG1, DCBLD2, APP, CROCC, EFNA5, GATA3, LYN"
HALLMARK_APOPTOSIS,1.2213083669019735e-10,1.0991775302117761e-9,0.826657301178302,0.7472045752661082,2.0301152724311393,160,"SLC20A1, CDKN1A, GADD45B, CCND1, HSPB1, ATF3, PSEN1, EMP1, RELA, IER3, AIFM3, BCL2L11, DAP, CFLAR, GCH1, PDGFRB, ISG20, HMOX1, IL6, BGN, IRF1, GPX3, CYLD, SQSTM1, CD44, SPTAN1, NEDD9, CAV1, TGFBR3, MCL1, CASP8, TIMP3, LMNA, CTNNB1, CASP1, PPP3R1, PTK2, IGF2R, APP, SOD2, RARA, IL1A, GSN, GSTM1, CASP6, FDXR, TAP1, IL1B, AVPR1A, ERBB2, FAS, CDK2, CASP3, DNAJC3, TIMP1"
HALLMARK_BILE_ACID_METABOLISM,5.235126792955274e-4,0.0011372861653661458,0.10982581942285836,0.6417650974504192,1.6702309554536479,109,"TTR, RBP1, BMP6, IDI1, IDH1, CH25H, ATXN1, ABCA4, ABCA1, ABCA5, LIPE, AR, NEDD4, IDH2, PEX13, EFHC1, HSD17B6, NR3C2, SLC23A2, FDXR, PAOX, ABCA9, CYP27A1, ABCD1, NR1I2, HSD3B7, PEX1, ALDH9A1, GSTK1, CROT, APOA1, ABCD3, PIPOX, CYP46A1, MLYCD, RXRG, EPHX2, PEX26, SLC27A5"
HALLMARK_CHOLESTEROL_HOMEOSTASIS,0.003844792943525457,0.006546539336273075,0.041313263939566934,0.6525122806535254,1.605550645261138,71,"JAG1, PLAUR, ATF3, GPX8, STARD4, IDI1, TRIB3, PPARG, ADH4, FABP5, CTNNB1, ANXA13, PCYT2, GSTM2, LDLR, AVPR1A, CBS, S100A11, ANTXR2, PLSCR1, FBXO6"
HALLMARK_COAGULATION,3.3446336904273555e-7,1.4047461499794893e-6,0.674962860011025,0.7000885888738534,1.8690999719798598,136,"THBS1, MAFF, THBD, FYN, CFH, PROS1, CTSK, MMP15, FBN1, CFB, HMGCS2, PECAM1, APOC3, DCT, GDA, SERPINE1, SERPING1, C9, TFPI2, TIMP3, C8G, BMP1, MMP8, VWF, GSN, HNF4A, CPQ, ANG, A2M, LRP1, KLF7, TIMP1, FN1, TF, ITGA2, MST1, GNG12, CTSE"
HALLMARK_COMPLEMENT,4.83108919258902e-6,1.6018874691216224e-5,0.610526878385931,0.6324316763657928,1.7538478119765337,196,"F5, MAFF, FYN, CFH, TNFAIP3, S100A9, CD36, PLAUR, CP, CD59, PSEN1, MMP15, CFB, L3MBTL4, CCL5, IL6, PIM1, EHD1, IRF1, SERPINE1, COL4A2, SERPING1, C9, CXCL1, TFPI2, ZEB1, CD55, CR1, CASP1, MMP8, SH2B3, AKAP10, DOCK9, HNF4A, DOCK4, GATA3, CPQ, ANG, LYN, LRP1, PIK3CG, CASP3, SRC, ERAP2, TIMP1, FN1, VCPIP1"
HALLMARK_DNA_REPAIR,0.6680010690883672,0.6680010690883672,0.0022335207013863493,0.33738173797325444,0.9055520453333018,143,"TP53, ADA, ERCC1, POLH, AGO4, CCNO, POLD3, SEC61A1, COX17, BCAM, POM121, NME3, POLB, ELL, NME4, REV3L, RAD52, RRM2B, CSTF3, SAC3D1, POLR1D, TK2, PDE4B, ADCY6, AK3, TAF10, NT5C, POLR2A, DUT"
HALLMARK_E2F_TARGETS,0.010265055461899163,0.015397583192848745,0.023883137755344612,0.509563054644714,1.4094499076085036,191,"CDKN1A, MYC, AK2, WDR90, ATAD2, BUB1B, TCF19, TP53, BARD1, IPO7, SYNCRIP, HNRNPD, TFRC, CDKN2A, POLD3, DCLRE1B, LMNB1, SRSF1, E2F8, CBX5, SMC6, HELLS, GSPT1, CDC25A, GINS4, RPA1, EZH2, ASF1A, CHEK1, MTHFD2, KIF4A, DIAPH3, RFC1, TIPIN, PSIP1, NUP107, PLK1, BRCA2, PAICS, STAG1, PDS5B, DSCC1, CCNE1, DDX39A, XPO1, NASP, ORC2, DUT, DEK, CCNB2, STMN1, TK1, MCM3, MCM6, RAD50"
HALLMARK_EPITHELIAL_MESENCHYMAL_TRANSITION,2.328801626833349e-12,7.33572512452505e-11,0.8986712320616942,0.7432520606240325,2.0611728491577757,196,"CXCL8, THBS1, SFRP1, IGFBP4, POSTN, COL11A1, COL4A1, FBLN1, TGFBI, GADD45B, TNFAIP3, SGCD, PLAUR, COL3A1, CD59, FBN1, GAS1, COL6A2, DKK1, TPM2, LOXL1, FSTL1, SERPINH1, GEM, CALD1, PMP22, PDGFRB, CXCL6, MSX1, IL6, COL8A2, TAGLN, BGN, FOXC2, MFAP5, FLNA, SERPINE1, CD44, SNTB1, ELN, COL4A2, IGFBP2, CDH2, LAMC1, DST, CDH6, CXCL1, CALU, MYL9, TFPI2, TGFBR3, ITGAV, TGM2, NOTCH2, SLIT2, GPX7, TIMP3, ABI3BP, BMP1, VCAM1, ITGB5, ITGA5, IL32, COL7A1, CXCL12, PLOD2, FGF2, OXTR, APLP1, FBN2, PCOLCE, PRSS2, TNC, AREG, LAMA3, COL1A1, FAS, LRP1, PDLIM4, SERPINE2, TIMP1, FN1, FSTL3"
HALLMARK_ESTROGEN_RESPONSE_EARLY,1.9215662034631698e-7,8.647047915584265e-7,0.6901324587967956,0.6622525770365717,1.8347415603784165,194,"IGFBP4, CA12, SLC26A2, FLNB, MYC, CCND1, ABHD2, KCNK15, SCNN1A, RPS6KA2, SNX24, SYNGR1, IL17RB, WFS1, RHOBTB3, ELOVL5, TPBG, CD44, BCL2, SVIL, NAV2, RBBP8, RAB17, RHOD, TMPRSS3, GFRA1, FOXC1, ADCY9, PGR, WWC1, TGM2, ASB13, SLC22A5, SEC14L2, AR, HSPB8, NRIP1, CISH, MSMB, OVOL2, DLC1, SLC7A5, KCNK5, CLDN7, RARA, CXCL12, NXT1, ENDOD1, FRK, SYT12, AKAP1, SFN, MAST4, OLFM1, AREG, TBC1D30, THSD4, CELSR1, TGIF2, LRIG1, BHLHE40, RAPGEFL1, AMFR, SLC19A2, ELOVL2, B4GALT1, MED13L, ALDH3B1, CHPT1, INPP5F"
HALLMARK_ESTROGEN_RESPONSE_LATE,1.0431560961221336e-7,5.974439459608583e-7,0.7049757151672383,0.6740563461947168,1.8700757394978484,197,"IGFBP4, PRLR, CA12, EMP2, SLC26A2, FLNB, S100A9, DLG5, CCND1, ABHD2, IMPA2, LLGL2, CDH1, SCNN1A, RPS6KA2, HMGCS2, IL17RB, ISG20, WFS1, ZFP36, PLXNB1, TPSAB1, ELOVL5, TPBG, CD44, SORD, BCL2, FGFR3, RBBP8, CAV1, TMPRSS3, KLK11, FOXC1, PGR, CHST8, TFPI2, ST6GALNAC2, PERP, FABP5, UGDH, GAL, SLC22A5, HSPB8, IDH2, NRIP1, CISH, OVOL2, SLC7A5, KCNK5, CXCL12, NXT1, FRK, SFN, CACNA2D2, SLC2A8, OLFM1, AREG"
HALLMARK_FATTY_ACID_METABOLISM,0.0014769929937511834,0.002869808776237076,0.06407146614846002,0.5774608221474242,1.5614181826414097,153,"ACSM3, CD36, SUCLG2, HMGCS2, RAP1GDS1, CIDEA, CEL, IDI1, HPGD, AADAT, ELOVL5, PPARA, IDH1, ACSS1, GPD1, HMGCL, CRAT, XIST, G0S2, UGDH, ODC1, SLC22A5, HSDL2, ACAA2, FABP1, PTPRG, GLUL, INMT, BMPR1B, AOC3, VNN1, HADHB, CPT1A, GCDH, GPD2, KMT5A, ACADS, S100A10, HADH, CYP4A11, ACOX1, UROD, ALDH9A1, ENO3, ACADVL"
HALLMARK_G2M_CHECKPOINT,0.003040472381428681,0.005472850286571626,0.04406757513925102,0.5402445824002257,1.4911485343071156,187,"MYC, CCND1, SLC7A1, NUMA1, MTF2, ABL1, BARD1, EGF, ODF2, KATNA1, SYNCRIP, CHAF1A, G3BP1, HNRNPD, PML, NOTCH2, MEIS2, ODC1, LMNB1, SRSF1, SMARCC1, SLC7A5, GSPT1, CDC25A, EZH2, RAD54L, EFNA5, CHEK1, PRC1, MT2A, KIF4A, LIG3, FOXN3, KIF5B, KMT5A, KNL1, E2F3, RASAL2, SS18, INCENP, CASP8AP2, PLK1, TLE3, BRCA2, CUL1, RBM14, STAG1, PDS5B, DDX39A, XPO1, MARCKS, NASP, DTYMK, CUL3, PTTG3P, CCNB2, STMN1, NUP98, MCM3, MCM6, FANCC"
HALLMARK_GLYCOLYSIS,3.6723890020424135e-5,1.101716700612724e-4,0.40794208975761354,0.6088926221516002,1.6878234240089165,195,"TGFBI, FBP2, AGRN, IER3, HDLBP, PFKFB1, PGLS, ISG20, GAL3ST1, STC1, SDC3, PGAM2, ADORA2B, PMM2, TPBG, CD44, GALK1, IDH1, CXCR4, DSC2, SLC35A3, CLDN3, NOL3, MET, ALDOB, CHST6, PC, CYB5A, SOX9, B4GALT4, ME2, GPC3, AGL, PLOD2, EXT1, BPNT1, RRAGD, PKM, CASP6, CHPF, COPB2, P4HA2, ANG, PAXIP1, SDC2, CITED2, KDELR3, LDHC, VCAN, PYGB, B4GALT1, MPI, HK2, B4GALT2, ERO1A, DCN, MERTK, ANGPTL4, ALDH9A1, AK3, NASP, GPC4, COL5A1, RPE, SDC1, CHPF2, CACNA1H, CLN6, HS2ST1, GALE, STMN1"
HALLMARK_HEDGEHOG_SIGNALING,0.16371104251717614,0.19834222458811723,0.007689891401265898,-0.5219809749459284,-1.231830634396223,36,"SCG2, NKX6-1"
HALLMARK_HEME_METABOLISM,0.0018886865971312382,0.0034996251652725887,0.055887058617053724,0.5478681820044126,1.5145457285399038,190,"BTRC, CROCCP2, PGLS, SLC30A10, BMP2K, CTNS, HBD, TFDP2, BACH1, HBB, MFHAS1, TFRC, GMPS, NR3C1, ACKR1, RBM38, KHNYN, GYPA, FBXO9, ALDH6A1, DCUN1D1, MBOAT2, SELENBP1, BCAM, EPB41, RHAG, ARHGEF12, RCL1, TNS1, PC, ENDOD1, SLC7A11, FBXO7, LRP10, P4HA2, SLC25A37, SLC10A3, NNT, TNRC6B, FTCD, AHSP, FN3K, CLIC2, DAAM1, CTSE, GYPE, UROD, BTG2, FOXO3, NARF, ALAS2, PRDX2, IGSF3, FECH, SLC6A9"
HALLMARK_HYPOXIA,4.147818082775679e-11,7.990496674495523e-10,0.851339057116899,0.7257421795395116,2.0106367043207807,194,"CA12, MAFF, CDKN1A, TGFBI, TNFAIP3, PLAUR, CP, ATF3, IER3, HDLBP, BCAN, ACKR3, ISG20, STC1, HMOX1, SDC3, S100A4, IL6, PIM1, PGAM2, ADORA2B, ZFP36, BGN, SERPINE1, TPBG, GALK1, BCL2, CXCR4, NCAN, CAV1, FOSL2, PPP1R15A, NR3C1, JMJD6, TGM2, RORA, SELENBP1, ALDOB, MT1E, GCK, TES, RBPJ, GPC3, SLC25A1, EXT1, KLF6, CHST3, RRAGD, CASP6, P4HA2, ANXA2, GBE1, MAP3K1, SDC2, MT2A, CITED2, PGM1, KDELR3, KLF7, CDKN1C, NDST2, SLC6A6, LDHC, BHLHE40, AKAP12, INHA, PDK1, PGF, NOCT, HK2, ERO1A, NEDD4L, DCN, FOXO3, ANGPTL4, SLC2A3, ENO3"
HALLMARK_IL2_STAT5_SIGNALING,3.7217145707478404e-8,2.3446801795711395e-7,0.7195128263389107,0.6743385496014402,1.8692366409493673,195,"MAFF, POU2F1, ANXA4, GADD45B, MYC, EMP1, PHLDA1, RGS16, MAPKAPK2, GPR83, CDCP1, NFKBIZ, RNH1, PIM1, SHE, MXD1, GALM, CD44, GLIPR2, BCL2, COCH, NCOA3, ST3GAL4, AHNAK, HUWE1, SYT11, ITGAV, CSF1, TGM2, LIF, RORA, COL6A1, ODC1, IGF2R, CISH, NCS1, SERPINB6, CSF2, TWSG1, SELL, IL4R, MYO1E, RHOH, CKAP4, APLP1, PLAGL1, KLF6, RRAGD, CTLA4, MAP6, HOPX, FGL2, ETFBKMT, CASP3, CD79B, MYO1C, CDKN1C, TNFRSF1B, TNFRSF21, DENND5A, LRIG1, ENPP1, BHLHE40, RABGAP1L, PLSCR1, P2RX4, SWAP70, SLC29A2, HK2, BCL2L1, SLC39A8, PTCH1, IRF6, AGER, SYNGR2, SLC2A3, ENO3, CCND2, CCNE1, PLIN2"
HALLMARK_IL6_JAK_STAT3_SIGNALING,2.816064565242955e-4,6.823541061934852e-4,0.15163823907294688,0.6870365055540711,1.7380935995371192,87,"SOCS3, CD36, CSF2RB, IL17RB, CXCL3, HMOX1, OSMR, IL6, PIM1, IRF1, CD44, LEPR, STAT3, CXCL1, PDGFC, CSF1, ACVRL1, MYD88, CSF2, IL4R, IL15RA, IL1B, FAS, A2M, PTPN2, TNFRSF1B, TNFRSF21"
HALLMARK_INFLAMMATORY_RESPONSE,5.0920344222519064e-11,7.990496674495523e-10,0.851339057116899,0.7286945470851522,2.023543678747503,199,"CXCL8, SGMS2, NAMPT, IFITM1, CDKN1A, CCL2, SELE, PLAUR, MYC, PSEN1, RELA, SLC7A1, EDN1, RGS16, GCH1, ICAM1, C5AR1, CXCL6, CCL5, OSMR, IL6, CD82, ADORA2B, MXD1, IRF1, MSR1, SERPINE1, TPBG, CALCRL, HBEGF, PDPN, CD55, CSF1, ABCA1, IL7R, LIF, MET, NLRP3, DCBLD2, P2RX7, SLC1A2, ITGA5, ITGB8, SLAMF1, TNFAIP6, CCL20, PCDH7, SELL, IL4R, GPC3, LDLR, IL1A, KLF6, IL15RA, IL1B, STAB1, NMUR1, LYN"
HALLMARK_INTERFERON_ALPHA_RESPONSE,4.311021742946091e-5,1.2345198627527443e-4,0.392556945943889,0.709306687638006,1.8075066572640428,92,"IFITM1, RSAD2, EPSTI1, ISG20, IRF1, NUB1, CD74, MOV10, MVB12A, CSF1, CASP8, CASP1, TRIM14, TRIM5, PROCR, SELL, IL4R, SLC25A28, SP110, HELZ2, TAP1, TRAFD1, LGALS3BP, CD47, OASL, OGFR, B2M, RIPK2, PLSCR1, SAMD9, PARP14, IL15, OAS1, HLA-C, HERC6, IRF7, TXNIP, NMI, IFIH1, PSMB8, DDX60, TRIM25"
HALLMARK_INTERFERON_GAMMA_RESPONSE,6.3416640273774e-11,7.990496674495523e-10,0.8390889356212738,0.722176431377571,2.0007579562820337,194,"SOCS3, NAMPT, CDKN1A, CCL2, PTGS2, CFH, TNFAIP3, CFB, RSAD2, GCH1, CSF2RB, ICAM1, EPSTI1, ISG20, CCL5, IL6, PIM1, MX2, IRF1, CD74, XAF1, IRF5, SERPING1, IL18BP, APOL6, NCOA3, STAT3, HLA-A, OAS2, PML, CASP8, VCAM1, GBP6, CASP1, TRIM14, MYD88, SOD2, TNFAIP6, IDO1, IL4R, SLC25A28, SP110, HELZ2, VAMP8, IL15RA, TAP1, TRAFD1, ZBP1, LATS2, LGALS3BP, SAMHD1, FAS, MT2A, FGL2, MTHFD2, CASP3, PELI1, OASL, PTPN2, OGFR, B2M, SPPL2A, RIPK2, BANK1, PLSCR1, FPR1, CASP7, PARP14, IL15, ARID5B, SSPN, HERC6, NLRC5, PDE4B, AUTS2, ITGB7, IRF7, TXNIP, ZNFX1, STAT4"
HALLMARK_KRAS_SIGNALING_DN,3.453517634170575e-4,8.058207813064676e-4,0.13086767921404507,0.5764102277956228,1.5952635343656867,192,"KCNMB1, KCNE2, EDN1, FGGY, RSAD2, EFHD1, CPEB3, SHOX2, BARD1, EGF, KCNQ2, C5, PDE6B, ADRA2C, FGFR3, IGFBP2, SLC38A3, MAGIX, ARPP21, ITGB1BP2, GP2, COPZ2, RGS11, CAPN9, NOS1, KRT5, LFNG, RYR1, THNSL2, GPRC5C, PAX3, ATP6V1B1, AKR1B10, TFF2, TCF7L1, PTGFR, ALOX12B, BMPR1B, ACTC1, ASB7, KMT2D, VPREB1, NR6A1, MAST3, ABCB11, STAG3, RIBC2, SERPINA10, BTG2, CD80, SYNPO, TGM1, TCL1A, ITIH3"
HALLMARK_KRAS_SIGNALING_UP,0.005663642857344525,0.00914896153878731,0.03215070296967761,0.5217524710525889,1.4469142896309672,196,"PTGS2, CFH, TNFAIP3, PLAUR, EMP1, CFB, JUP, RGS16, CIDEA, MALL, F2RL1, MPZL2, TFPI, PECAM1, GPNMB, TOR1AIP2, BTC, IKZF1, HBEGF, ALDH1A3, CXCR4, PPP1R15A, ADAM17, SLPI, AMMECR1, ZNF277, IL7R, HDAC9, IL33, ETV1, G0S2, LIF, CD37, DCBLD2, CSF2, CCL20, GALNT3, SOX9, NIN, HKDC1, PRDM1, IL1B, GNG11, MAP3K1, AKT2, ITGBL1, TNFRSF1B, CBX8, AKAP12, RABGAP1L, ITGA2, AVL9, TMEM176B, CBR4, CBL, ITGB2, ANO1, TLR8, ERO1A, RETN, ANGPTL4, PDCD1LG2, TMEM176A, CROT, CCND2, ANKH, EVI5, KIF5C, MMP9, ACE, ENG, SPON1, GADD45G"
HALLMARK_MITOTIC_SPINDLE,1.2346649823049236e-7,6.481991157100849e-7,0.6901324587967956,0.6722703157522371,1.86598933903364,198,"ALMS1, FLNB, TBCD, BCL2L11, BCAR1, LRPPRC, NUMA1, ARHGEF7, ABL1, KATNA1, CLIP1, FLNA, SORBS2, PREX1, SPTAN1, DST, VCL, NEDD9, EZR, ARHGAP5, NOTCH2, KIF3B, MAPRE1, STAU1, LMNB1, CNTROB, MID1, MYO9B, EPB41, ECT2, ARHGEF12, ABR, ARHGEF2, DYNC1H1, TLK1, TUBGCP3, TRIO, ARHGAP29, NIN, ACTN4, MYO1E, GSN, CDC42BPA, CDC42EP2, DOCK4, RAB3GAP1, PRC1, RICTOR, KIF4A, PDLIM5, PCGF5, PXN, RFC1, FGD6, SPTBN1, SASS6, KIF5B, CYTH2, ALS2, HOOK3, DLG1, RASAL2, INCENP, CDC42EP1, PLK1, SAC3D1, BRCA2"
HALLMARK_MTORC1_SIGNALING,7.089664403645789e-5,1.8610369059570198e-4,0.29144105040995055,0.6043514465343469,1.6706900162311946,190,"NAMPT, CDKN1A, POLR3G, EIF2S2, PHGDH, UFM1, SERPINH1, HSPD1, IFRD1, GGA2, STC1, STARD4, RIT1, IDI1, TRIB3, ELOVL5, SQSTM1, SORD, IDH1, ACTR2, ACACA, CXCR4, TFRC, GMPS, PPP1R15A, EDEM1, ACTR3, TES, PIK3R3, SLC7A5, CDC25A, SLC7A11, LDLR, RPA1, PLOD2, FDXR, GBE1, FGL2, MTHFD2, PGM1, SLC6A6, BHLHE40, PDK1, INSIG1, ITGB2, HK2, PLK1, SYTL2, ERO1A, BTG2, SLC2A3"
HALLMARK_MYC_TARGETS_V1,0.1826643877107015,0.21310845232915177,0.0053144104171099354,0.4144686544091325,1.1428919475876063,185,"MYC, EIF2S2, U2AF1, HSPD1, IFRD1, SSBP1, SYNCRIP, FBL, G3BP1, HNRNPD, AIMP2, PRPS2, UBA2, ODC1, SNRPA1, SRSF1, UBE2L3, SMARCC1, GSPT1, RUVBL2, CDK2, HNRNPR, CUL1, CLNS1A, PRDX3, TRIM28, SERBP1, XPO1, SF3B3, PPM1G, RPL14, ORC2, DUT, DEK"
HALLMARK_MYC_TARGETS_V2,0.04002081690177267,0.051455336016564865,0.01280445158443662,0.5970908228905728,1.4159324928596195,55,"SLC19A1, MYC, HSPD1, SORD, MAP3K6, AIMP2, TCOF1, RCL1, LAS1L, SLC29A2, HK2, PLK1, MYBBP1A, PES1"
HALLMARK_MYOGENESIS,4.81405273604784e-7,1.895533264818837e-6,0.6594443980379349,0.65676823605091,1.821337508571193,196,"CDKN1A, PTP4A3, GADD45B, SGCD, SOD3, CD36, COL3A1, IGFBP7, AGRN, COL6A2, TPM2, IFRD1, RIT1, SORBS3, PDLIM7, TAGLN, PGAM2, GPX3, SVIL, NQO1, KIFC3, NAV2, GNAO1, DAPK2, COL4A2, HBEGF, SPTAN1, PTGIS, GJA5, ADCY9, CASQ2, CRAT, MYH11, ITGB5, HSPB8, NOS1, MYF6, BDKRB2, APP, RYR1, PC, LPIN1, AGL, GSN, FGF2, TEAD4, SH2B1, COL1A1, AKT2, ACTC1, LDB3, MYO1C, DES, HDAC5, BHLHE40, COL6A3, TPM3"
HALLMARK_NOTCH_SIGNALING,0.10888991030329248,0.13720128698214853,0.007774248423986975,0.6109575283435067,1.320223997922497,31,"JAG1, CCND1, TCF7L2, NOTCH3, NOTCH2, LFNG, DTX1, DLL1, ARRB1, ST3GAL6, FZD1"
HALLMARK_OXIDATIVE_PHOSPHORYLATION,0.5519544786868413,0.5608569702785646,0.002567629709953501,0.348265154068799,0.9582608368087375,181,"LRPPRC, AFG3L2, MRPS12, ACAT1, BDH2, IDH1, ATP6V0E1, ALDH6A1, NDUFS1, COX17, IDH2, COX4I1, MTRF1, CYB5A, ACAA2, MRPS15, FXN, GLUD1, NNT, HADHB, CPT1A, CASP7, SLC25A20, PDK4, PRDX3, ACADVL, POR"
HALLMARK_P53_PATHWAY,1.3754287753023583e-7,6.665539449542198e-7,0.6901324587967956,0.67660446994765,1.8704287701488853,190,"TM4SF1, CDKN1A, ATF3, TP63, IER3, RRAD, SLC35D1, RGS16, PTPN14, HEXIM1, HMOX1, S100A4, SERTAD3, TP53, CD82, MXD1, GLS2, TRIB3, ADA, WRAP73, HBEGF, SP1, CDKN2A, POLH, PPP1R15A, ABHD4, LIF, PERP, MDM2, EPHA2, SEC61A1, CASP1, PROCR, TRAF4, POM121, APP, ZFP36L1, BLCAP, RCHY1, SLC7A11, MAPKAPK3, DRAM1, IL1A, VAMP8, FDXR, TAP1, SFN, TRAFD1, FAS, GM2A, SLC19A2, RAB40C, S100A10, EPS8L2, NINJ1, BTG2, FOXO3, ITGB4, PIDD1, CCND2, RAP2B, ACVR1B, TXNIP, FOS, NDRG1, SDC1, STEAP3, CCNK, STOM, PRMT2, ABCC5"
HALLMARK_PANCREAS_BETA_CELLS,0.022411603435068338,0.030694152530637075,0.021539006305356056,-0.632202601776876,-1.5212163980080313,40,"SST, NKX6-1, SCGN, PCSK1, MAFB, SRP9, SRP14"
HALLMARK_PEROXISOME,8.597471127645754e-6,2.7082034052084123e-5,0.5933254763964051,0.707906567786337,1.8247795246526575,101,"TTR, ITGB1BP1, CTBP1, CEL, IDI1, ELOVL5, ERCC1, IDH1, ATXN1, IDE, HMGCL, CRAT, STS, IDH2, PEX13, SOD2, SMARCC1, SLC23A2, FABP6, ABCB9, ABCD1, NR1I2, HSD3B7, ACOX1, ALDH9A1, GSTK1, CADM1, ABCD3, HAO2, CLN6, ABCC5, MLYCD, RXRG, TSPO, EPHX2"
HALLMARK_PI3K_AKT_MTOR_SIGNALING,0.001503233168505135,0.002869808776237076,0.06491072443977143,0.6253959743635409,1.6179844372638539,104,"CDKN1A, AKT1, IL4, RIT1, TRIB3, VAV3, SQSTM1, ACTR2, ACACA, CXCR4, PTEN, ACTR3, MYD88, PIK3R3, SFN, MAPK8, RPS6KA3, CDK2, PRKCB, PDK1, MAPKAP1, SMAD2, THEM4, TNFRSF1A, NFKBIB, MKNK1"
HALLMARK_PROTEIN_SECRETION,0.31716295334321915,0.3505485273793475,0.003998121251834815,0.42082487850559536,1.0765244086779147,95,"CAV2, DST, GNAS, TOM1L1, ABCA1, GOLGA4, VPS45, IGF2R, ATP6V1B1, CLN5, COPB2, RPS6KA3, SNX2, SSPN, ARFGEF2, SNAP23, AP2B1"
HALLMARK_REACTIVE_OXYGEN_SPECIES_PATHWAY,0.1734201174920642,0.20614089437735933,0.005922264326691913,0.5243973463796539,1.217799519821402,48,"PDLIM1, GPX3, NQO1, SCAF4, SOD2, MBP, FES, ABCC1, JUNB, PRDX2, MGST1, TXNRD2"
HALLMARK_SPERMATOGENESIS,0.5258341745882785,0.5430746393288779,0.002748696699629591,0.3628095479475121,0.9654772505294571,132,"GSTM3, DNAJB8, PDHA2, SHE, HOXB1, IDE, GFI1, ACRV1, TEKT2, SYCP1, NOS1, LPIN1, PIAS2, EZH2, DPEP3"
HALLMARK_TGF_BETA_SIGNALING,0.003355257815671945,0.005871701177425904,0.044851876697103256,0.6980644691917214,1.6415647261726884,52,"THBS1, SLC20A1, TGFBR1, ARID4B, CDH1, SERPINE1, SMURF2, PPP1R15A, SMAD6, TRIM33, CTNNB1"
HALLMARK_TNFA_SIGNALING_VIA_NFKB,7.436233376546216e-13,4.684827027224116e-11,0.9214260034948982,0.7507013049620698,2.079784860645639,194,"SOCS3, NAMPT, JAG1, MAFF, CDKN1A, CCL2, PTGS2, GADD45B, TNFAIP3, PLAUR, MYC, CCND1, ATF3, TNFAIP8, RELA, IER3, TNIP2, BCL2A1, PHLDA1, ACKR3, EDN1, CFLAR, GEM, GCH1, ICAM1, F2RL1, CXCL6, CXCL3, CCL5, SLC16A6, IL6, EHD1, ZFP36, MXD1, IRF1, KLF2, NFKB2, SERPINE1, SQSTM1, CD44, HBEGF, FOSL2, PPP1R15A, CXCL1, CSF1, ABCA1, IL7R, MCL1, ZBTB10, G0S2, LIF, PHLDA2, LITAF, TRIP10, SOD2, TNFAIP6, CSF2, CCL20, LDLR, DRAM1, REL, IL1A, KLF6, NR4A1, IER2, STAT5A, IL15RA, SPSB1, TAP1, IL1B, CXCL2, TNC, SIK1, AREG, PLPP3, B4GALT5"
HALLMARK_UNFOLDED_PROTEIN_RESPONSE,4.412324077596044e-4,9.927729174591098e-4,0.11999882235125048,0.6519602652647077,1.6867098704724361,104,"FKBP14, CCL2, ATF3, ERN1, EXOC2, WFS1, FUS, ALDH18A1, EDEM1, DCP2, SLC7A5, CNOT2, EXOSC1, CNOT6, SHC1, BAG3, CNOT4, POP4, MTHFD2, DNAJC3, KDELR3, ATF6, RPS14, HYOU1, KIF5B, WIPI1"
HALLMARK_UV_RESPONSE_DN,5.84015220778159e-7,2.1642917005308247e-6,0.6594443980379349,0.6974976072227748,1.8637458366787938,137,"FZD2, COL11A1, RBPMS, FYN, ANXA4, MYC, COL3A1, PIK3CD, SLC7A1, PMP22, PDGFRB, TFPI, MTA1, ADORA2B, SERPINE1, PPARG, ATXN1, LAMC1, CAV1, PRKCE, NR3C1, PTEN, TGFBR3, WDR37, PTPN21, NOTCH2, MET, DDAH1, APBB2, NFIB, MMP16, MT1E, SIPA1L1, PIK3R3, DLC1, CDON, SYNE1, LDLR, CDC42BPA, PTGFR, ERBB2, PRDM2, MAP2K5, ANXA2, PLPP3, COL1A1, DYRK1A, SDC2, LTBP1, CITED2, PDLIM5, ABCC1, BHLHE40, TJP1, INSIG1, DLG1, PIAS3, EFEMP1, MAGI2"
HALLMARK_UV_RESPONSE_UP,0.012149543591654247,0.01744360845386284,0.022238433707376624,0.5265199141750088,1.4246616085221078,154,"ATF3, BCL2L11, RRAD, GCH1, ICAM1, MSX1, SHOX2, HMOX1, IL6, IRF1, GPX3, SQSTM1, TFRC, IGFBP2, TYRO3, FGF18, GAL, RAB27A, HLA-F, SOD2, NR4A1, TAP1, CXCL2, SPR, TMBIM6, OLFM1, APOM, LYN, CDK2, NTRK3, DNAJB1, CASP3, CDKN1C, PPP1R2, EIF5, UROD, BTG2, MAPK8IP2, JUNB, STARD3, CDC34, CCNE1"
HALLMARK_WNT_BETA_CATENIN_SIGNALING,7.317493112947659e-4,0.0015366735537190083,0.09713462922293536,0.7711523626016019,1.746686722726802,41,"JAG1, MYC, DKK1, TP53, SKP2, ADAM17, CTNNB1, RBPJ, DLL1, FZD1, HDAC5, CSNK1E, HDAC11, CUL1, PTCH1, CCND2"
HALLMARK_XENOBIOTIC_METABOLISM,3.1879842123381566e-9,2.5105375672162985e-8,0.7749390301364363,0.6988022937548465,1.9350430188744545,193,"IGFBP4, GSTM4, CYP2E1, MCCC2, FBLN1, PROS1, CD36, GART, ESR1, CFB, BCAR1, SLC35D1, LCAT, JUP, GCH1, UPB1, HMOX1, DHRS1, SLC46A3, ELOVL5, SERPINE1, IDH1, NQO1, CYP26A1, AOX1, ACOX3, CNDP2, ENPEP, EPHA2, ALDH2, UGDH, ENTPD5, CYP2C18, PC, CYB5A, FABP1, HNF4A, CASP6, TMBIM6, CYP27A1, DDAH2, COMT, FAS, MT2A, HSD17B2, PDLIM5, VNN1, SLC6A6, TMEM176B, SLC12A4, XDH, CYP2S1, AP4B1, NINJ1, MTHFD1, ANGPTL3, ACOX1, PDK4, GCKR, ALDH9A1, HGFAC, POR, CROT, ARG2, ABCC3, TNFRSF1A, CYP1A2"
SMITA_FA_OXIDATION,0.006687188196582104,0.01027543552157738,0.031578751718426716,0.6618862837547728,1.5824849801104126,58,"PCBP2, CP, HMGCS2, ACAT1, ACOX3, HMGCL, ALDH2, SLC22A5, LPCAT3, SLC7A11, HADHB, CPT1A, ACADS, ACOX1, SLC25A20, ACADVL, CROT, STEAP3, MLYCD, ACOX2, ETFDH, SLC27A5"
SMITA_FA_SYNTHESIS,0.015579607125638205,0.021811449975893488,0.020217970609696385,0.5790064984494497,1.4668888527308037,88,"ACSM3, SGSH, GGA2, CTNS, ELOVL5, GNS, ACACA, ACSBG1, ELOVL7, HGSNAT, NPC2, LITAF, IGF2R, MAN2B1, ACACB, CLN5, ABCB9, GM2A, CD164, CBR4, ACADS, ELOVL2, GNPTAB, AP4B1, ACADVL, ENTPD4, HSD17B8, TPP1, NAGLU, ACSM2A, OLAH"
SMITA_GLUCONEOGENESIS,0.32817276596581246,0.3544066165156114,0.004076545841631733,0.4696683072031542,1.0869046959608268,47,"HMGCS2, ACAT1, GPD1, HMGCL, ALDOB, PC, ME2, SLC25A1, PKM, PFKFB2, PGM1, GPD2, HADH, SLC2A3"
SMITA_GLUTAMATE_RECEPTORS,0.2622164247127159,0.2949934778018054,0.004129749675570795,0.37612385927225395,1.0806495828602487,293,"BAIAP3, GRIK4, BCL2A1, SCNN1A, AFG3L2, C5AR1, NFKBIZ, NTSR2, RGS9, BMP2K, WT1, CALCRL, GPHB5, GRIK5, NR3C1, SIX4, MYL9, MYOD1, ADRA1D, ETV1, ETV6, RORA, ADRB1, PRKD3, GAL, LTB4R, NAPEPLD, CHRNA4, EYA1, SIPA1L1, RUNX1T1, MAF, NPBWR1, KCNK5, PAX3, SOX9, REL, OXTR, TBXA2R, PUM2, APLN, JMJD1C, HTR2A, PTGFR, AVPR1A, DOCK4, KMT2A, AFDN, NMUR1, PRLHR, GNRH1, GALR1, TAAR9, SPX, FPR1, TACR1, FLI1, GRIN2B, PDE1A, PER2, P2RX2, FARP2, PLCE1, KCNC3, CD80, ADCY6, ITGB7, OPA1, KRIT1, HOXA11, GRID1, MLLT1, CALHM1, GIPR, NOS1AP, RAP1GAP, SS18L1, GRM1"
SMITA_GLYCOGENESIS,9.739864048847526e-11,1.0226857251289903e-9,0.8390889356212738,0.637204875125144,1.8669200116622968,380,"S100A8, ROR1, IFITM1, RIF1, S100A9, ARID2, PLXNC1, NFATC2, NTNG1, IL4, IQCE, RSAD2, WNT11, TBL1X, CXCL6, ARHGEF7, FGFR2, IL17RB, ZNF274, MAVS, CLEC2B, USP25, CCDC88C, CLIP1, FRZB, BMP7, ENAH, BTC, GNAO1, PREX1, CRB1, NRG2, TBX3, CARD11, RHOD, MYF5, STK3, ARID1B, WWC1, TRAF5, SLIT2, SEMA7A, LIF, EPHA2, SESN2, GRK7, YAP1, DISP1, CDX2, NTNG2, GRB10, NRG1, SRSF1, DPYSL5, PGM3, IL17RC, RGS3, NTN1, SH2B3, BRD7, TRAF4, RND1, SLAMF1, CISH, ELF5, FAT4, JARID2, SMARCC1, CCL20, LPIN1, RCHY1, LRIG2, NTN3, RNF152, KAT6A, BTK, SERPINF1, FGF2, SSH1, RRAGD, CTLA4, CASP6, TAP1, SFN, IL17F, FES, SEMA4F, HCK, RASSF4, LATS2, AFP, LGR4, GBE1, AREG, BMPR1B, RICTOR, ZFHX3, RASSF6, EVC2, NTRK3, CD79B, PGM1, CDC14B, MAPKAP1, PLCG2, PYGB, SAV1, CBY1, IL25, ITGB2, HK2, HESX1, PLK1, CXCR2, MUC5AC, CUL1, OAS1, VANGL2, ERO1A, SMARCD1, MSN, GSK3A, SCUBE2, JUNB, NF2, CD22, PBRM1, TAB3, STAG1"
SMITA_GLYCOGENOLYSIS,0.18837015964107942,0.2157694555888728,0.005881906662874531,0.6456995020467563,1.2512730293159446,17,"PHKB, GBE1, PGM1, PYGB, G6PC2, PHKA2, PGM2, PGM5, GYS2"
SMITA_GLYCOLYSIS,0.030723884987581187,0.04118307987697053,0.013863028842315755,0.4952161951159229,1.3446485755913191,159,"ISYNA1, HSPD1, LSM8, XRN1, PLEKHM1, INPP5B, PGM2L1, IPMK, ALDOB, NEUROD1, PATL1, GCK, DCP2, PIK3C2A, CNOT2, EXOSC1, IPPK, GSN, SP100, ARHGEF26, PKM, DIS3, TMBIM6, RHOJ, CNOT4, ANXA2, PGM1, S100A10, HK2, INPP5F, CNOT3, TLR9, CNOT6L, EXOSC3, DHX36, ABCF2, CNOT7, JAK3, PKLR, MYO6, LSM3, PAN3, RHOB, GSDMD, NR5A2, EXOSC2, BHLHA15, GTF2A1L, NKX2-2, LSM5"
SMITA_HMP_SHUNT_GLUTATHIONE,0.14981413729406054,0.18506452253972186,0.006410902387487055,0.5309187060552163,1.2409788934028942,50,"TTR, PTGIS, ALOXE3, CYP2B6, PDIA4, ALOX12B, ALOX5"
SMITA_KETONE_BODY_SYNTHESIS,0.005849972647702407,0.009213706920131291,0.034823214659093216,0.7772065574468018,1.6283760685366475,26,"HMGCS2, IDI1, ELOVL5, ACAT1, BDH2, ACSS1, HMGCL, ACAA2"
SMITA_LACTATE_SHUTTLE,0.012182837650316903,0.01744360845386284,0.02243992314750482,0.5453010995470307,1.4460587609004956,128,"SLC4A2, TP63, SLC7A1, MSX1, PIM1, TRIM71, FGFR3, FOXP1, MIR146A, TRRAP, NSF, TIMP3, TRPM4, MMP16, HOXD10, SLC22A7, MDM4, SHC1, EZH2, IL15RA, GLUL, TNC, SOX4, ZEB2, UBE2I, ABCC1, HDAC5, E2F3, ABCB11, MIR34A, IL15, CPLX2, PDK4, RANBP3, SLC2A3, ABCC3, XPO1, MARCKS, DICER1, SLC6A11, TRAK2, GLS, SLC16A9, VAMP2, CCNB2, STMN1, RIMS2, PDCD4"
SMITA_TCA_CYCLE,0.4679540473131283,0.4913517496787847,0.003334302686163032,0.48444698494573885,1.0003651844571575,24,"SUCLG2, IDH1, IDH2, ACO1"
