pathway,pval,padj,log2err,ES,NES,size,LEGenes
HALLMARK_ADIPOGENESIS,0.08911961347007548,0.14396245252858347,0.009256412799405572,0.4050341724492744,1.2033128497845564,191,"ANGPTL4, BCL6, ABCA1, SOWAHC, SORBS1, AGPAT3, RIOK3, SAMM50, CMBL, DBT, TKT, COL4A1, HSPB8, RETN, AK2, PTGER3, NDUFA5, PFKFB3, APOE, MYLK, SNCG, BAZ2A, RREB1, DHRS7, PLIN2, SDHC, SLC19A1, DHCR7, STOM, SLC25A1, CRAT, LPCAT3, LAMA4, ITSN1, SDHB, FZD4, PTCD3, ADIG, SULT1A1, PPARG"
HALLMARK_ALLOGRAFT_REJECTION,0.35889900916979506,0.4365170364240331,0.004259556582076688,0.34694958297126144,1.031990143863793,193,"EGFR, TAP1, INHBA, CARTPT, TIMP1, JAK2, IL4R, C2, LCP2, GBP2, DYRK3, LIF, IL6, PF4, CCND3, LCK, IRF7, TGFB2, CXCR3, RPS19, CD7, WAS, CCR2, LTB, F2R, NCF4, CD47, SOCS1, CD40, RIPK2, CCL2, HLA-DOB, IL11, CSF1, BCAT1, ICAM1, FAS, NCR1, IL12RB1, SIT1, KLRD1, CD28, ZAP70, FLNA, PRF1, BCL10, IL4, CCL5, GALNT1, IRF4, EIF4G3, HIF1A"
HALLMARK_ANDROGEN_RESPONSE,7.357553884401211e-5,3.310899247980545e-4,0.3353727818391055,0.6553511599154572,1.786668380975597,95,"BMPR1B, NGLY1, ELOVL5, APPBP2, IDI1, UBE2I, ACSL3, SLC26A2, SAT1, PMEPA1, FKBP5, PIAS1, ELK4, RRP12, AKAP12, PTPN21, CCND3, XRCC5, CDC14B, VAPA, HPGD, B4GALT1, XRCC6, SPDEF, SEC24D, CAMKK2, ABHD2, ALDH1A3, ADAMTS1, ARID5B, STEAP4, PDLIM5"
HALLMARK_ANGIOGENESIS,0.39429366198543475,0.4686886925487243,0.004028839487167812,0.44805832058003947,1.0394416505789796,35,"FGFR1, TIMP1, VAV2, SERPINA5, FSTL1, PF4, VEGFA, APOH, PDGFA, PGLYRP1, MSX1, NRP1"
HALLMARK_APICAL_JUNCTION,0.001992660239888596,0.005021503804519261,0.06338615826903203,0.5005028453356432,1.486939982135798,191,"ITGB4, EGFR, SHC1, VAV2, AKT2, SDC3, AKT3, NRXN2, CLDN15, EVL, NECTIN1, CD99, CTNNA1, WASL, B4GALT1, LAMA3, CLDN14, MADCAM1, CRAT, CDH15, MDK, SLIT2, SRC, DLG1, ICAM1, MPZL2, ADAM9, CLDN5, MPZL1, ICAM2, DMP1, LAMC2, ADAM15, SORBS3, YWHAH, PCDH1, CADM3, ADAM23, MMP2, VASP, NF2, BMP1, ACTN3, GAMT, RHOF, ITGA9, ACTG2, PBX2, BAIAP2, CD209, PARVA, PIK3R3, RAC2, CDH4, PECAM1, SLC30A3, SKAP2, INPPL1, NECTIN2, CNTN1, ADAMTS5, CDH3, MSN, RSU1, COL9A1, GNAI2, COL17A1, DSC3, VCAN, NFASC"
HALLMARK_APICAL_SURFACE,0.08875723606512943,0.14396245252858347,0.009308140978034117,0.5507546308186259,1.3255278165480686,43,"HSPB1, SRPX, ATP8B1, DCBLD2, EFNA5, GATA3, B4GALT1, RHCG, SLC2A4, PCSK9, CD160, PLAUR, LYPD3, GSTM3, EPHB4"
HALLMARK_APOPTOSIS,2.542137860906542e-4,8.429193959848007e-4,0.17824658693829382,0.5557480698545295,1.61893544456993,160,"GADD45B, CDKN1A, EMP1, SQSTM1, JUN, MCL1, KRT18, HSPB1, CD44, TAP1, CASP7, NEDD9, SPTAN1, TIMP1, DNAJC3, SAT1, HMOX1, XIAP, DAP3, CASP6, CREBBP, ROCK1, CFLAR, ISG20, DFFA, TXNIP, CYLD, IL6, IFNB1, HGF, TGFB2, RHOB, SLC20A1, SATB1, ERBB3, PLCB2, F2R, CTNNB1, IFITM3, CASP8, LMNA, FAS, ADD1, CTH, ATF3, PAK1, DCN, TGFBR3, BTG3, GNA15, TNFRSF12A, IGF2R, GSN, PRF1, BCL10, PEA15, DDIT3, MMP2, SOD2, PSEN1"
HALLMARK_BILE_ACID_METABOLISM,0.33388454019302544,0.42928012310531843,0.0044634411194010145,0.3792367942997168,1.053721297842755,109,"ABCA1, IDI1, PECR, AR, ATXN1, LCK, SLC23A2, APOA1, MLYCD, AGXT, NR1H4, SOAT2, PEX6, TTR, HSD3B7, ABCA2, ACSL5, AMACR, CYP39A1, GCLM, SERPINA6, NR0B2, TFCP2L1"
HALLMARK_CHOLESTEROL_HOMEOSTASIS,0.026384387497002653,0.05194426288472397,0.0173480899517763,0.5458005684091525,1.4266016178059275,71,"FDFT1, LDLR, IDI1, NFIL3, FABP5, GUSB, DHCR7, HSD17B7, CTNNB1, GLDC, MVK, ATF5, ALCAM, SQLE, FASN, ABCA2, ATF3, PPARG, TMEM97, GPX8, TNFRSF12A, PLSCR1, PLAUR"
HALLMARK_COAGULATION,0.007893670788402554,0.017760759273905746,0.03183351696757737,0.50625702843301,1.4464829468096192,136,"MAFF, THBS1, TIMP1, SH2B2, PRSS23, SPARC, C2, FYN, GNG12, FGA, PDGFB, MSRB2, F11, SERPINC1, PF4, F12, GP1BA, ITGB3, APOA1, MMP11, C8A, PROC, WDR1, FGG, KLF7, MMP3, CFH, F3, SERPINE1, SERPING1, ADAM9, CAPN5"
HALLMARK_COMPLEMENT,0.04835689596173588,0.0823374174483611,0.012701729997117897,0.42303168131051205,1.2603103342720197,196,"MAFF, DGKH, CP, CASP7, S100A12, TIMP1, JAK2, PIM1, FCN1, CD59, C2, FYN, LCP2, PCLO, CR1, RBSN, PDGFB, SERPINC1, IL6, LCK, IRF7, F5, GP1BA, WAS, GATA3, CASP10, AKAP10, CBLB, GNGT2, COL4A2, CFH, EHD1, F3, DOCK10, SRC, SERPINE1, SERPING1, ADAM9, KCNIP3, S100A9, PCSK9, CPM, CDA, PLG, GNAI3, PLSCR1, MT3, BRPF3, PLAUR, GRB2, TMPRSS6, GP9, PSEN1, CCL5, IRF1, ME1"
HALLMARK_DNA_REPAIR,0.015258552306433594,0.03100931597759085,0.02371555250022384,-0.48446138622715673,-1.398772169437544,143,"RPA3, ZWINT, RFC4, ERCC3, FEN1, PRIM1, NME1, NT5C3A, RFC2, GMPR2, MPC2, CMPK2, HCLS1, RPA2, POLR3C, ITPA, SRSF6, ALYREF, RFC5, RBX1, PCNA, NCBP2, VPS28, POLR2E, POLR2G, NUDT21, POLR3GL, BCAP31, SUPT4H1, GTF2B, CETN2, TMED2, POLR2K, TSG101, GPX4"
HALLMARK_E2F_TARGETS,0.5089246559006594,0.5829500603953007,0.0034014517858624582,0.3280702656491508,0.9746613820277015,191,"CDKN1A, XPO1, CBX5, TFRC, ATAD2, PDS5B, MTHFD2, PRKDC, AK2, STAG1, HELLS, CHEK1, BIRC5, MKI67, SPC24, PTTG1, SMC3, PSIP1, DCLRE1B, LYAR, XRCC6, TIMELESS, GINS4, WDR90, CDC25A, SMC4, KIF2C, E2F8, HMGA1"
HALLMARK_EPITHELIAL_MESENCHYMAL_TRANSITION,2.023238802602837e-6,1.8209149223425535e-5,0.6272567397185284,0.6020301457988466,1.7935886313362102,196,"GADD45B, CADM1, SDC4, THBS1, JUN, PMP22, FGF2, CD44, INHBA, GEM, TIMP1, TGM2, PLOD2, PDLIM4, CD59, SERPINH1, SPARC, SAT1, FBN2, PMEPA1, TNC, LRRC15, NOTCH2, COL4A1, COL1A1, CDH2, FERMT2, SGCD, CALD1, IL6, PVR, FSTL1, MYLK, VEGFA, ABI3BP, RHOB, FSTL3, ITGB3, FBLN1, IL32, SNTB1, PRRX1, NTM, LAMA3, AREG, DST, MMP3, ITGA5, LOXL2, TPM2, COL4A2, FUCA1, SLIT2, SERPINE1, TAGLN, FAS, EMP3, SFRP1, DCN, TGFBR3, LAMC2, P3H1, TNFRSF12A, DPYSL3, COL7A1, FLNA, MSX1, DKK1, FOXC2"
HALLMARK_ESTROGEN_RESPONSE_EARLY,4.3183727556406494e-8,6.801437090134023e-7,0.7195128263389107,0.6350362350773666,1.8899349812135733,194,"SLC7A2, TIPARP, GFRA1, UGCG, RHOBTB3, FDFT1, WFS1, ELOVL5, LRIG1, KRT18, CD44, SLC1A4, TGM2, JAK2, MICB, WWC1, SLC26A2, ELF3, PRSS23, AR, FKBP5, KDM4B, NAV2, SNX24, XBP1, STC2, NADSYN1, RAB31, HSPB8, FARP1, IGF1R, RRP12, ADCY9, KRT13, MED13L, MSMB, PDLIM3, ALDH3B1, TUBB2B, FKBP4, MYB, RHOD, TSKU, IL17RB, CA12, MYBL1, MAST4, KRT15, SVIL, KLF10, DHCR7, TTC39A, TMPRSS3, B4GALT1, AREG, CALCR, SOX3, PAPSS2, FAM102A, ABHD2, SLC19A2, IL6ST, RET, NRIP1, FASN, HES1, MAPT, NXT1, ADD3, SLC16A1, SLC2A1, KLK10, THSD4, BCL2, NCOR2, TJP3"
HALLMARK_ESTROGEN_RESPONSE_LATE,7.767348680896552e-4,0.002224286213165831,0.10161294534463561,0.5144222591828204,1.5333124810412029,197,"SERPINA3, FDFT1, WFS1, ELOVL5, CD44, SLC1A4, JAK2, MICB, SLC26A2, PRSS23, PRLR, FKBP5, XBP1, ST14, FABP5, SERPINA5, RAB31, HSPB8, FARP1, PTGER3, ISG20, KRT13, PDLIM3, ALDH3B1, DNAJC1, FKBP4, MYB, GJB3, LLGL2, IL17RB, CA12, IGSF1, ZFP36, CHST8, DHCR7, TMPRSS3, AREG, CALCR, SOX3, PAPSS2, FAM102A, ABHD2, MDK, DLG5, IL6ST, RET, NRIP1, MAPT, JAK1, NXT1, ADD3, SLC16A1, S100A9, KLK10, LAMC2, BCL2, SLC2A8, BTG3, NCOR2, TJP3"
HALLMARK_FATTY_ACID_METABOLISM,0.5801865024757518,0.6305165165611654,0.003278986742366034,-0.3249344364740632,-0.9455347841529977,153,"MCEE, SUCLA2, MDH1, CRYZ, PTS, APEX1, ACAT2, CA2, METAP1, ADSL, GABARAPL1, NTHL1, PDHB, IDH3B, CIDEA, CA4, D2HGDH, ACADM, ALDH1A1, RETSAT, BPHL, MDH2, UROD, DHCR24, AADAT, PSME1, GSTZ1, ENO2, ERP29, HSD17B11, BCKDHB, PDHA1, ALDOA, GCDH, SERINC1, OSTC, DLST, HMGCS1, GRHPR, AUH, ACOT8"
HALLMARK_G2M_CHECKPOINT,1.5399896820691303e-4,5.707020586491483e-4,0.22953411326510875,0.5456328563457393,1.6171443449271021,187,"XPO1, MT2A, RASAL2, E2F2, CUL4A, PDS5B, TLE3, KMT5A, NOTCH2, KIF5B, STAG1, RAD54L, G3BP1, PML, CHEK1, BIRC5, MKI67, PTTG1, EFNA5, YTHDC1, PURA, NUP98, MTF2, DMD, CCNT1, ODC1, SMARCC1, E2F3, UPF1, KNL1, ATF5, SQLE, TNPO2, SLC7A1, EWSR1, DR1, CDC25A, SMC4, KIF2C, HMGA1, NUP50, TPX2, NUMA1, CCNA2, TACC3, KPNB1, RBL1, GSPT1, CCNB2, ABL1, RBM14, ESPL1, DTYMK, HNRNPD, STIL, HIF1A, FOXN3, TRA2B"
HALLMARK_GLYCOLYSIS,4.6163078769600073e-5,2.2371338172960035e-4,0.4252889604172581,0.5603664775334398,1.6684634516979167,195,"ANGPTL4, IRS2, DDIT4, ABCB6, EGFR, GALK2, SOX9, CD44, ELF3, PLOD2, ZNF292, MET, STC2, SDC3, NOL3, CASP6, ISG20, EXT1, NDST3, DSC2, B4GALT4, VEGFA, CHPF, FKBP4, UGP2, HDLBP, ALDOB, P4HA1, PKM, B3GALT6, CLDN3, LHX9, TPST1, SDHC, GUSB, COG2, B4GALT1, ARTN, IDUA, PHKA2, ALDH7A1, DPYSL4, HOMER1, CTH, CAPN5, B4GALT2, CLN6, PFKP, DCN, P4HA2, G6PD, PGLS, PPIA, PKP2, AGRN, SLC35A3, MED24"
HALLMARK_HEDGEHOG_SIGNALING,0.34107131821271863,0.4297498609480255,0.004405499792662334,0.4617938337362691,1.0768993814056622,36,"NRP2, TLE3, PML, VEGFA, SHH, PLG, NRP1, CDK6, ADGRG1, GLI1, LDB1"
HALLMARK_HEME_METABOLISM,0.0032710298356403715,0.007925956909436285,0.04945652246405631,0.49191120160566093,1.460493600750557,190,"SLC25A37, DAAM1, HBB, TFRC, ABCB6, RIOK3, ALDH1L1, FOXO3, TNRC6B, HBZ, PDZK1IP1, PRDX2, CROCCP2, E2F2, LRP10, HBD, ALDH6A1, TYR, MFHAS1, SEC14L1, MARK3, BLVRA, CCND3, TRIM10, BACH1, RAP1GAP, TAL1, RBM38, OSBP2, KEL, TRAK2, XPO7, HBBP1, EPOR, GATA1, RHAG, SNCA, RCL1, IGSF3, ADD1, TNS1, ARHGEF12, RBM5, EZH1, SLC2A1, P4HA2, TSPAN5, SMOX, PGLS, ACKR1, VEZF1, GCLM, BMP2K, GMPS, NFE2, RANBP10, RNF19A, MINPP1, CLIC2"
HALLMARK_HYPOXIA,5.181000515697603e-15,1.6320151624447451e-13,0.9969862175331805,0.7317935333557438,2.1778949315331677,194,"MAFF, ANGPTL4, CDKN1A, CSRP2, TIPARP, IRS2, PGF, SDC4, SLC2A3, CP, JUN, DDIT4, EGFR, DTNA, ADM, PPP1R15A, MT2A, CHST3, FOXO3, JMJD6, TGM2, NFIL3, RORA, PIM1, MT1E, GCK, KLHL24, SRPX, HMOX1, FOSL2, CDKN1C, BTG1, ZNF292, STC2, ANXA2, SDC3, TGFB3, CASP6, HEXA, ISG20, PDGFB, EXT1, ATP7A, PFKFB3, AKAP12, IL6, KLF6, PRKCA, VEGFA, UGP2, HDLBP, ALDOB, P4HA1, CA12, B3GALT6, PLIN2, ZFP36, IDS, EDN2, PCK1, KLF7, SLC25A1, NDST2, HS3ST1, DPYSL4, F3, TES, NEDD4L, SERPINE1, VHL, STBD1, NOCT, ATF3, DUSP1, PPP1R3C, PFKP, BCAN"
HALLMARK_IL2_STAT5_SIGNALING,1.4564982965056452e-5,8.341762970895969e-5,0.5933254763964051,0.5796520828723172,1.7258853870596136,195,"MAFF, GADD45B, EMP1, RGS16, SLC2A3, IL1RL1, LRIG1, NFKBIZ, CD44, TGM2, NFIL3, RORA, PIM1, PNP, MYO1C, IL4R, SYNGR2, MXD1, CDKN1C, XBP1, GALM, LIF, IGF1R, HIPK2, HUWE1, SERPINC1, KLF6, SLC29A2, COL6A1, CCND3, P4HA1, RHOB, PLIN2, SERPINB6, CD79B, IL3RA, SLC39A8, LTB, ODC1, SCN9A, IFITM3, GATA1, CSF2, SOCS1, TNFSF11, POU2F1, TNFRSF9, PUS1, ALCAM, AGER, MAP6, CSF1"
HALLMARK_IL6_JAK_STAT3_SIGNALING,1.3479897323606445e-7,1.698467062774412e-6,0.6901324587967956,0.7402741699258018,1.99402322794566,87,"SOCS3, TNFRSF1A, CBL, JUN, OSMR, CD44, PIM1, IL4R, STAT3, HMOX1, IL6, DNTT, PF4, IL17RB, ITGB3, PTPN1, IL3RA, LTB, LTBR, CSF2, SOCS1, IL1R1, IL6ST, CSF1, FAS, TNFRSF1B, IL12RB1, TNFRSF12A, PTPN2"
HALLMARK_INFLAMMATORY_RESPONSE,2.805404823759089e-4,8.697030254069243e-4,0.1694223120380443,0.5321622581059758,1.5879714826903735,199,"CDKN1A, NAMPT, ABCA1, SLC7A2, RGS16, ADM, LDLR, OSMR, INHBA, TIMP1, SGMS2, IL4R, NFKBIA, IFITM1, MXD1, LCP2, MET, DCBLD2, SLC4A4, LIF, PDE4B, APLNR, FZD5, TNFSF15, IL6, PVR, ROS1, KLF6, HBEGF, LCK, IRF7, IRAK2, GP1BA, ITGB3, OSM, EIF2AK2, ITGA5, SLC31A1, PTGER4, CD40, IL1R1, F3, SLC1A2, RIPK2, TNFRSF9, CCL2, SERPINE1, CSF1, ICAM1, SLC7A1, EMP3, CXCR6, EDN1, SPHK1, TNFRSF1B, PDPN, SLC28A2, GNA15, GNAI3, CCR7, KCNA3, PLAUR, ITGB8, PSEN1, SLAMF1, NMUR1, CCL5, IRF1, CCL24, HIF1A, LAMP3, EBI3, ATP2A2, PTPRE"
HALLMARK_INTERFERON_ALPHA_RESPONSE,0.12991695001141115,0.20461919626797256,0.007603256904766349,0.4464735368269739,1.212069122980238,92,"NUB1, PSMA3, TAP1, IL4R, IFITM1, NCOA7, TRIM25, GBP2, ISG20, TXNIP, IFITM2, IRF7, CD47, EIF2AK2, IFITM3, TRIM14, RNF31, CASP8, OASL, RIPK2, CSF1"
HALLMARK_INTERFERON_GAMMA_RESPONSE,0.009319338300057309,0.019570610430120348,0.029240716405406972,0.46658470920042605,1.3886054289639331,194,"SOCS3, CDKN1A, NAMPT, LATS2, PSMA3, AUTS2, SAMHD1, MT2A, TAP1, CASP7, JAK2, PIM1, PNP, IRF5, IL4R, NFKBIA, STAT3, MTHFD2, LCP2, BTG1, TRIM25, SPPL2A, PDE4B, ISG20, TXNIP, IL6, PML, PSMB2, IFITM2, IRF7, PTPN1, ZBP1, EIF2AK2, IFITM3, TRIM14, SOCS1, PELI1, CFH, RNF31, VAMP5, CD40, CASP8, OASL, RIPK2, CCL2, RNF213, ICAM1, FAS, SERPING1, ARID5B"
HALLMARK_KRAS_SIGNALING_DN,0.02865618351038248,0.05470725942891201,0.016592451148041674,0.4394685367912162,1.3063590947114907,192,"BMPR1B, GDNF, ZBTB16, HSD11B2, SYNPO, SLC16A7, ARPP21, MTHFR, CALCB, KRT13, NTF3, NR6A1, KCND1, TGFB2, COQ8A, PAX3, KRT15, GP1BA, ATP4A, DTNB, OXT, EDN2, RYR2, EDAR, SSTR4, IDUA, KLHDC8A, SHOX2, CALML5, KCNMB1, GPRC5C, HNF1A, EDN1, BRDT, CAMK1D, TFF2, IL5, COL2A1, CYP39A1, CHRNG, PAX4, PDCD1, SKIL, ASB7, GP2, TFCP2L1, LYPD3, PROP1, TFAP2B, CDKAL1"
HALLMARK_KRAS_SIGNALING_UP,2.5376124143075204e-4,8.429193959848007e-4,0.17824658693829382,0.53584655776155,1.5964122408961254,196,"SERPINA3, ANGPTL4, EMP1, RGS16, CBL, GADD45G, SOX9, IKZF1, PPP1R15A, INHBA, AVL9, F2RL1, SNAP25, DCBLD2, AKT2, LIF, RETN, CBR4, ZNF277, AKAP12, PDCD1LG2, HBEGF, SDCCAG8, USH1C, PRDM1, MYCN, SATB1, LAT2, MMP11, ANO1, PPBP, PIGR, KIF5C, NR1H4, PRRX1, WNT7A, ARG1, TNNT2, CSF2, HKDC1, STRN, FUCA1, CFH, TFPI, ALDH1A3, MPZL2, GPRC5B, MALL, ETV5, TNFRSF1B, DNMBP, PEG3, TOR1AIP2, NGF, PLAUR, ADAM17, AMMECR1, NRP1, NR0B2, ADGRL4, TMEM176B"
HALLMARK_MITOTIC_SPINDLE,6.857116959342461e-9,1.439994561461917e-7,0.7614608014455848,0.6435524000647461,1.9191938242636861,198,"CTTN, PPP4R2, FGD4, RICTOR, CCDC88A, CDC42BPA, ALMS1, NEDD9, SPTAN1, RASAL2, AKAP13, SORBS2, TRIO, SYNPO, RAB3GAP1, NOTCH2, ARHGEF7, CLIP1, TBCD, KIF5B, FARP1, ROCK1, APC, RANBP9, KATNB1, CNTROB, RABGAP1, BIRC5, PALLD, CD2AP, CEP250, PCM1, SMC3, PXN, ARHGAP5, RASA2, WASL, SSH2, PCNT, DST, ABR, ITSN1, TLK1, BCAR1, ARHGAP29, DLG1, TUBD1, MID1, CNTRL, PCGF5, ARHGEF12, SMC4, KIF2C, PDLIM5, CYTH2, TPX2, KLC1, NUMA1, FLNA, GSN, DYNC1H1, HOOK3, MAP3K11, RAPGEF5, LRPPRC, SPTBN1, CCNB2, ABL1, ESPL1, WASF2, RALBP1, RHOF, CDK5RAP2, ATG4B, RAPGEF6, KIF1B, PIF1, ECT2, TUBGCP2"
HALLMARK_MTORC1_SIGNALING,1.1159984145125973e-4,4.687193340952909e-4,0.27021998157260674,0.5510491348840607,1.6360752358765547,190,"CDKN1A, HSPD1, NAMPT, UBE2D3, SQSTM1, SLC2A3, ELOVL5, TFRC, DDIT4, PSMA3, DAPP1, LDLR, PPP1R15A, SLC1A4, PSPH, IDI1, NFIL3, ACSL3, PLOD2, PNP, SERPINH1, MTHFD2, XBP1, GSK3B, DHFR, NUPR1, P4HA1, IGFBP5, ACTR2, IFRD1, EIF2S2, DHCR7"
HALLMARK_MYC_TARGETS_V1,0.7590276217345351,0.783913773266815,0.002692175916865956,-0.30006902210562203,-0.8922631959812657,185,"RFC4, GNL3, NME1, APEX1, PRPS2, SNRPD1, COX5A, CYC1, PSMA1, PSMB3, PSMA4, NHP2, POLE3, NDUFAB1, GLO1, MCM2, PSMD14, PHB2, PCNA, EIF3D, TOMM70, PSMC6, NCBP2, ILF2, PCBP1, COPS5, ABCE1, CCT7, SRPK1, PSMD7, C1QBP, CSTF2, CTPS1, VBP1, RPL6, RAN, PSMD8, TUFM, NOLC1, DEK, PSMA2, SNRPD3, AP3S1, SRM, LSM7"
HALLMARK_MYC_TARGETS_V2,0.282062099876915,0.37808324026054563,0.004939539995420812,0.4411724084899631,1.1073402707125517,55,"HSPD1, RRP12, SLC29A2, SLC19A1, MAP3K6, PUS1, RCL1, TFB2M, TMEM97"
HALLMARK_MYOGENESIS,2.2837250306024407e-5,1.1989556410662814e-4,0.5756102610711286,0.5764295035621964,1.7173183296063304,196,"GADD45B, CDKN1A, PDE4DIP, ITGB4, SORBS1, DTNA, FGF2, CNN3, SPTAN1, SPARC, MYO1C, DES, SYNGR2, NAV2, STC2, AKT2, COL1A1, HSPB8, APLNR, ADCY9, SGCD, SMTN, MYBPH, MYLK, HBEGF, MYH8, TCAP, MAPRE3, KLF5, SVIL, LDB3, TEAD4, TNNI2, IFRD1, ERBB3, DMD, WWTR1, SPDEF, NOTCH1, TNNT2, CRAT, TPM2, MYBPC3, COL4A2, AK1, MEF2D, TAGLN, PPP1R3C, IGFBP7, SPHK1, EPHB3, PTGIS, PLXNB2, SORBS3, CHRNG, AEBP1, GSN, CSRP3, AGRN"
HALLMARK_NOTCH_SIGNALING,0.1422370100978837,0.21855930819918715,0.007242400117063727,0.5608840059741979,1.2715451402807143,31,"TCF7L2, APH1A, NOTCH2, FZD5, PRKCA, NOTCH1, HES1, ST3GAL6, HEYL, KAT2A, PSEN2, JAG1"
HALLMARK_OXIDATIVE_PHOSPHORYLATION,0.0019080391772935007,0.005008602840395439,0.06741866099624878,-0.5090201284715469,-1.5097045583225868,181,"MTX2, SLC25A5, NDUFS3, SUCLA2, MDH1, SLC25A4, UQCRFS1, MRPL15, DLAT, UQCRC1, AIFM1, COX6C, SLC25A12, COX5A, CYC1, ATP6V1E1, ALAS1, NDUFB5, NDUFA9, SLC25A11, NDUFAB1, UQCRQ, PDHB, NDUFA1, IDH3B, NDUFS6, VDAC2, MRPL11, ATP6AP1, MRPL34, OXA1L, ACADM, NDUFA4, IMMT, PHB2, OAT, NDUFS2, NDUFV2, TOMM70, GPI, NDUFB3, COX7B, RETSAT, MRPS22, UQCR10, PDP1, ISCA1, COX7A2, ATP6V0B, MDH2, MTRF1, SLC25A6, COX5B, ETFA, ACADSB, NDUFA8, NDUFA6, PDHA1, ISCU, ATP6V1C1, LDHB, FDX1, DLST, COX11, GPX4"
HALLMARK_P53_PATHWAY,3.276245059893908e-6,2.5800429846664526e-5,0.6272567397185284,0.5988846021880356,1.7780996371472004,190,"CDKN1A, ITGB4, RGS16, JUN, DDIT4, MKNK2, PPP1R15A, TAP1, FOXO3, ZBTB16, SAT1, HMOX1, MXD1, BTG1, RRAD, VDR, SERTAD3, ST14, ZFP36L1, RRP8, LIF, WRAP73, PRMT2, OSGIN1, PLK3, TXNIP, GPX2, SP1, PITPNC1, HBEGF, CCND3, NUPR1, MAPKAPK3, COQ8A, APAF1, PHLDA3, RPL18, IER5, STOM, F2R, NOTCH1, DEF6, SLC3A2, ZMAT3, GM2A, SOCS1, FUCA1, SLC19A2, PTPN14, AK1, EPS8L2, STEAP3, POLH, FAS, TP63, PDGFA, ATF3, SPHK1, SLC35D1, DRAM1, TM4SF1, PLXNB2, NHLH2, ABHD4, PERP, AEN"
HALLMARK_PANCREAS_BETA_CELLS,0.653489514628457,0.6977938885015726,0.0028562688460311444,0.37140777060044095,0.8825973609161846,40,"PAK3, GCK, VDR, AKT3, SLC2A2, HNF1A, PAX4, DCX, PKLR, SCGN"
HALLMARK_PEROXISOME,0.5267554516892885,0.5925998831504495,0.0033355142975656253,0.3498454269592799,0.9619749522407308,101,"CLN8, CADM1, ELOVL5, IDI1, HSD11B2, ATXN1, SLC23A2, MLYCD, CEL, SMARCC1, CRAT, PEX6, TTR, HSD3B7, ACSL5, CLN6, YWHAH, ESR2, ALB, SERPINA6, BCL10, ACOX1, SOD2"
HALLMARK_PI3K_AKT_MTOR_SIGNALING,0.00849989756831034,0.018465294717363846,0.030701132746281817,0.5359194352425047,1.4798110979194266,104,"CDKN1A, UBE2D3, SQSTM1, TNFRSF1A, EGFR, MKNK2, DAPP1, DUSP3, CFL1, GSK3B, LCK, FGF17, ACTR2, VAV3, GNA14, ARF1, MKNK1, ADCY2, GRK2, PRKAA2, EIF4E, SLC2A1, FGF6, PRKAR2A, PIKFYVE, NGF, GRB2, DDIT3, IL4"
HALLMARK_PROTEIN_SECRETION,0.2326458538247663,0.3331065634309154,0.0055210506037490096,0.4113763432002456,1.1215256034216239,95,"ABCA1, EGFR, KRT18, COPB1, ATP6V1H, GOSR2, ATP7A, RAB2A, GOLGA4, GNAS, COG2, SEC24D, DST, ARF1, YIPF6, VPS45, ICA1, ARFGEF2, STX16"
HALLMARK_REACTIVE_OXYGEN_SPECIES_PATHWAY,0.2074828484198877,0.31122427262983154,0.0058868204526254615,0.47850049997580574,1.174217636964117,48,"MGST1, PRDX2, NDUFB4, SCAF4, TXNRD2, PDLIM1, JUNB, MSRA, SBNO2, PFKP, G6PD, GCLM, SOD2"
HALLMARK_SPERMATOGENESIS,0.04676660702350162,0.08184156229112784,0.01343911050044811,-0.4566808643185868,-1.3057683281438834,132,"ART3, RFC4, NPY5R, SCG3, RAD17, TOPBP1, PSMG1, SNAP91, CCT6B, SCG5, PARP2, IFT88, CHRM4, HSPA2, ARL4A, CCNA1"
HALLMARK_TGF_BETA_SIGNALING,1.27783155856728e-4,5.031461761858665e-4,0.2530472461789223,0.736199268746507,1.8306755301953885,52,"UBE2D3, THBS1, PPP1R15A, TGIF1, PMEPA1, CDKN1C, XIAP, RAB31, SKI, APC, HIPK2, TRIM33, SMURF1, SMAD6, SLC20A1, KLF10, BMPR1A, SMAD1, WWTR1, JUNB, CTNNB1"
HALLMARK_TNFA_SIGNALING_VIA_NFKB,9.800043386477896e-16,6.174027333481075e-14,1.0175447973098848,0.7403803788697466,2.2034502917138568,194,"MAFF, SOCS3, GADD45B, CDKN1A, BCL6, NAMPT, ABCA1, TIPARP, IRS2, CEBPD, SQSTM1, SDC4, SLC2A3, JUN, SLC16A6, SIK1, MCL1, FOSB, LDLR, PPP1R15A, CD44, TAP1, INHBA, GEM, TGIF1, NFKB2, NFIL3, REL, F2RL1, PLPP3, NFAT5, SAT1, NFKBIA, PMEPA1, TNC, FOSL2, MXD1, BTG1, KLF9, LIF, PDE4B, CFLAR, PFKFB3, IL6, KLF6, VEGFA, FOSL1, HBEGF, TNIP2, SPSB1, RHOB, ZFP36, KLF10, IER5, B4GALT1, JUNB, AREG, KDM6B, CSF2, PTGER4, EHD1, F3, RIPK2, EGR1, TNFRSF9, IL6ST, CCL2, SERPINE1, CSF1, HES1, ICAM1, FUT4, EDN1, ATF3, DUSP1"
HALLMARK_UNFOLDED_PROTEIN_RESPONSE,2.899010084689748e-4,8.697030254069243e-4,0.1671324519526138,0.6110755991282826,1.687336554324827,104,"ATF6, BAG3, WFS1, DDIT4, SHC1, SLC1A4, DNAJC3, DCP2, GOSR2, MTHFD2, XBP1, CNOT4, STC2, NFYA, KIF5B, VEGFA, DDX10, WIPI1, KHSRP, ALDH18A1, CNOT2, CCL2, RPS14, DNAJA4, EIF4E, ATF3, EXOSC1"
HALLMARK_UV_RESPONSE_DN,8.604378704061472e-6,5.420758583558727e-5,0.5933254763964051,0.6302634720553848,1.8021539527275146,137,"NIPBL, MAP1B, PMP22, LDLR, CDC42BPA, CDK13, CELF2, MT1E, VAV2, NFIB, PLPP3, FYN, MET, NOTCH2, ANXA2, NR1D2, AKT3, COL1A1, CDON, ATXN1, IGF1R, MMP16, SIPA1L1, KALRN, PTPN21, PRKCA, SCN8A, IGFBP5, YTHDC1, ITGB3, BMPR1A, RASA2, DDAH1, RBPMS, EFEMP1, APBB2, TFPI, F3, DLG1, SERPINE1, SLC7A1, DUSP1, ICA1, PPARG, ADD3, PDLIM5, TGFBR3"
HALLMARK_UV_RESPONSE_UP,0.26749336036727095,0.366349602242132,0.005082376481223692,0.3726967360697949,1.0808314631078826,154,"DNAJB1, SQSTM1, TFRC, FOSB, NPTX2, TAP1, SPR, NUP58, NFKBIA, HMOX1, CDKN1C, BTG1, RRAD, AGO2, IL6, PDLIM3, PPP1R2, FKBP4, CCND3, RHOB, PPAT, MAOA, RAB27A, JUNB, SHOX2, IL6ST, RET, ICAM1, CDC5L, ATF3, SULT1A1"
HALLMARK_WNT_BETA_CATENIN_SIGNALING,0.26729457616109126,0.366349602242132,0.00509358964441244,0.4731180363342994,1.1293801343514989,41,"WNT1, NOTCH1, CTNNB1, CSNK1E, SKP2, NCOR2, DKK1, ADAM17, WNT6, TCF7, NOTCH4, KAT2A, PSEN2, JAG1, NKD1, MYC, PPARD, AXIN2, CCND2, CUL1, PTCH1, HDAC5, AXIN1, TP53"
HALLMARK_XENOBIOTIC_METABOLISM,0.00539648593759616,0.012591800521057708,0.03846919881569409,0.47967320374997674,1.4267721964275957,193,"PDK4, TNFRSF1A, SERTAD1, ELOVL5, ESR1, CNDP2, MT2A, CYP4F2, SLC12A4, HMOX1, PGD, CASP6, TYR, F11, APOE, HGFAC, CRP, FETUB, DHRS7, TGFB2, RAP1GAP, FBLN1, MAOA, TPST1, GSTT2, ENPEP, TAT, ARG1, CYP2C18, CSAD, PAPSS2, IL1R1, BCAR1, ATOH8, SERPINE1, UPB1, BCAT1, FAS, COMT, TMEM97, PDLIM5, SLC35D1, CDA, PLG, SMOX, CYP2E1, GART, ABCC3, SHMT2, SERPINA6, PYCR1, ACOX1, TMEM176B, ALDH3A1, IDH1, SLC22A1, NDRG2, ATP2A2, LEAP2, FBP1, CAT, EPHA2, ACSM1, TKFC, HNF4A, ADH1C, ENTPD5, SAR1B, FABP1, ACP1, FAH, DHRS1, RBP4, LCAT, GSR, IGF1"
SMITA_FA_OXIDATION,0.9016069154269301,0.9016069154269301,0.0021849213941207116,0.30092587754670375,0.7619155086323136,58,"CP, ACSL3, PCBP2, MLYCD, SLC39A14, LPCAT3, ACADVL, STEAP3"
SMITA_FA_SYNTHESIS,0.36029977609602737,0.4365170364240331,0.004263405016881897,0.3868706093550102,1.0437346772724847,88,"ELOVL5, ACSL3, NCOA7, OLAH, CBR4, IDS, HYAL4, ARSG, IDUA, GM2A, ACADVL, FUCA1, ACSM2A, FASN, ABCA2, ACSL5, ACSM3, IGF2R, DNASE2, ACSBG1, ACSM5, TPP1, LAMP3, ACADS"
SMITA_GLUCONEOGENESIS,0.7020919401507063,0.7371965371582416,0.0027027336382696924,0.3524541511198167,0.8618348678520736,47,"SLC2A3, ALDOB, PKM, SLC2A2, PCK1, SLC25A1, SLC2A4, FASN, SLC16A1, SLC2A1, PKLR, PGK1, ME1"
SMITA_GLUTAMATE_RECEPTORS,6.21180188613735e-7,6.522391980444218e-6,0.6594443980379349,0.5535378563461113,1.7156710423959054,293,"NFKBIZ, RUNX1T1, ADM, FOSB, SOX9, TAF15, ZBTB16, MAP3K2, REL, RORA, GRIA3, C2, MLLT1, ORAI2, SIX4, NFYA, GRM4, PTCRA, GRM1, ELK4, APLNR, SIPA1L1, SIPA1L2, KMT2A, BAIAP3, FKBP4, NUPR1, RALGAPA1, HTR2A, GRIN2C, NPBWR1, EVL, MYCN, PAX3, RAP1GAP, GNA12, CNGB1, KCND3, NOS1AP, SIPA1L3, GRIN2D, HRH3, LTB4R, OXT, GRIK5, F2R, GRIA2, CEBPE, CHRNA4, ARC, SIX1, PTGDR, CALHM1, RIN1, FLI1, P2RX2, EWSR1, PLCE1, SUPT3H, NTSR2, CAMK1D, KDM6A, AFG3L2, ETV6, OPRM1, AFF1, HCRT, AFDN, JMJD1C, PDE1A, MYOD1, PAX5, UTS2, RAPGEF5, FARP2, HOXA10, BMP2K, FCER1A, P2RY1, KCNK5, NMUR1, TRHR, HTR7, GNB3, GIPR, GLI3, C7, PPP1R17, RXFP2, NR4A3, PRKD3, GRM6, RAPGEF6, BCL11B, DAGLB, TLX1, C1R, LDB1, SCNN1A, GRM2, ARAP3, DAB1, GJA1, PRLH, AVP, QRFPR, TFF1, LMO2, RUNX2, AVPR1A, TACR3, MPO, TPCN2, TRPM5, GRIN2B, GPR156, OXTR, BDKRB1, ADORA1, GPER1"
SMITA_GLYCOGENESIS,7.079102823035401e-6,4.955371976124781e-5,0.610526878385931,0.501825119182997,1.5897915954169541,380,"GRB10, S100A8, SESN2, LATS2, BMPR1B, RICTOR, ARID2, FGF2, DAPP1, TAB2, TAP1, INHBA, AKAP13, WWC1, BOC, TBL1X, SSH1, IFITM1, CFL1, PIAS1, ARID1B, ARHGEF7, CLIP1, MUC5AC, PRKDC, CASP6, LIF, GPR161, STAG1, S100A7A, ROR1, IL17B, NRG2, GSK3B, SMARCB1, SLC38A9, NTF3, MAVS, TEAD1, MUC5B, IL17RC, RHOD, FRZB, UGP2, IL17RB, SMC3, PLXNC1, FNIP2, WNT11, CD79B, WAS, YAP1, RASSF4, CDC14B, ZFHX3, TAB3, NFATC2, WWTR1, LRRC4C, TRAF3IP2, JUNB, AREG, SMARCC1, MIB2, CBLB, ENAH, TNFSF11, USP25, AFP, SLIT2, SOX2, RGMA, ANAPC5, JARID2, NEO1, TBX3, RNF152, KAT6A, PBRM1, FGFR2, LGR4, CXCR6, SEMA3A, ZNF274, IHH, S100A9, INVS, PARVB, CLEC2B, ANGPT2, ROBO3, NTN3, LIMK1, GLI2, IL5, PLXNB2, RASSF6, NRG1, SMARCA2, HK3, NGF, REG4, PDCD1, TP73, GRAP2, SKIL, IL4, CSN2, NTN1, SLAMF1, VASP, NF2, SMARCD1, LCN2, NTRK3, BMP7, CER1, ZNRF3, RIF1, ICOS"
SMITA_GLYCOGENOLYSIS,0.5804755231832951,0.6305165165611654,0.003105018714683433,0.45596485801318576,0.9177013349504769,17,"PHKA1, PHKA2, PYGL, PHKG2, GYS1, PYGB, PGM1, PHKG1"
SMITA_GLYCOLYSIS,0.03495138153461057,0.06476285402001371,0.015005884979680707,0.4500099158562938,1.3100018044752881,159,"HSPD1, DCP2, GCK, PIK3C2A, CNOT4, ANXA2, ISYNA1, DDX6, DHX36, PGM2L1, ALDOB, PKM, RHOB, RASA2, ZCCHC7, IPPK, CNOT6L, DDX3X, CNOT2, HNF1A, DCP1B, PFKP, TLR9, EXOSC1, ARHGEF26, AHNAK2, PLEKHM1, HK3, PAX4, PIKFYVE, GSN, PKLR, PGK1, LSM4, MNX1, NR5A2, INPP5F, BAIAP2L1, RILP, IPMK, EXOSC3, CNOT7"
SMITA_HMP_SHUNT_GLUTATHIONE,0.04440727058695972,0.0799330870565275,0.013316861953251853,0.568543255422062,1.4046211094630885,50,"PRDX2, TKT, PGD, ALOX5, TTR, CYP2B6, TTF1, PDIA4, PTGIS, G6PD, GCLM, ALB, SERPINA7, TKTL1, CYP2C8, GGT1, TBXAS1, TTF2, DUOXA2, CYP4F3, GSR"
SMITA_KETONE_BODY_SYNTHESIS,0.4765867560512211,0.556017882059758,0.0035640050514216368,0.450346963777523,0.9872073576314071,26,"ELOVL5, IDI1, ACSS1, ACAA2, BDH2"
SMITA_LACTATE_SHUTTLE,0.0011574431309608322,0.0031703877065448883,0.08333852577581669,0.556617642389239,1.5783217245672725,128,"PDK4, XPO1, SLC2A3, NSF, DICER1, SHC1, UBE2I, SLC16A9, PIM1, CYP3A4, SNAP25, SLC6A11, E2F2, SLC16A7, TNC, XIAP, PCLO, ST14, AQP4, MMP16, SLC1A3, TGFB2, TRAK2, AGXT, NR1H4, FOXP1, E2F3, CYP1B1, TP63, SLC7A1, RAPGEF4, SLC22A7, SLC16A1, MDM4, SLC2A1, MSX1, MIR146A, ABCC3, SOX4, NR0B2, PIK3R1, HOXD10, TNFRSF13C, CCNB2"
SMITA_TCA_CYCLE,0.21630523154523884,0.3169123159848848,0.005979289967691593,-0.552363717493186,-1.2015359614033214,24,"SUCLA2, MDH1, DLAT, IDH3B, MDH2, PDHA1, DLST, ACLY, CS, IDH3G, FH"
SMITA_UREA_CYCLE,0.29849556871680405,0.39177543394080533,0.00477613404865674,0.46509333571211453,1.1052276855047847,40,"HSPB1, UPP2, TRPV4, SERPINB6, ARG1, NAGS, CDA, AGMAT, PIAS4, OTC, TYMP, NOX1, DTYMK, MEF2A, PECAM1, CAD, UCKL1"
SMITA_VARIOUS_METABOLITES,0.8810594760434614,0.8952701127538397,0.002223181415729839,0.34170069601634,0.7033969930524571,19,"HGD, NPC1L1, CEL, DBH, FAH"
